_unit_id,_golden,_unit_state,_trusted_judgments,_last_judgment_at,annotation,annotation:confidence,annotation_1,annotation_1:confidence,annotation_2,annotation_2:confidence,annotations,annotations:confidence,contains_age_mention,contains_age_mention:confidence,does_not_contain_age_mention,does_not_contain_age_mention:confidence,does_not_contain_an_age_mention,does_not_contain_an_age_mention:confidence,doesnt_contain_age_mention,doesnt_contain_age_mention:confidence,about_patient,annotation_gold,contains_age_mention_gold,does_not_contain_age_mention_gold,mentions_disease,portal_url,text_raw,text_toks,title_raw,title_toks
2684649279,false,finalized,3,3/13/2020 16:06:35,"",1.0,"",1.0,"",1.0,https://f8-text-annotation-live.s3.amazonaws.com/agg_report/2684649279/b0ff81e8157d356a1d189bd65e6f68c11560c055?X-Amz-Algorithm=AWS4-HMAC-SHA256&X-Amz-Credential=AKIAIK6U7WPQWDCESAOQ%2F20200415%2Fus-east-1%2Fs3%2Faws4_request&X-Amz-Date=20200415T154555Z&X-Amz-Expires=604800&X-Amz-SignedHeaders=host&X-Amz-Signature=47fa4c91642de3dc24eed81224e014784e13e2404b45f09f903a0bc00ba4a3f4,0,"",1.0,"",1.0,does_not_contain_an_age_mention,2.0,"",3.0,,,,,,,"Trimfit Keto Forskolin : - What's more , for what reason would we say we are confounded ? All things considered , we have to clarify a tad about eating regimen pills . It's obvious , most eating regimen pills that are coordinated towards the keto diet contain a fixing called Beta Hydroxybutyrate ( BHB ) . Furthermore , did we see any sign on the Official TrimFit Keto Forskolin Website that this pill had BHB in it ? No ! Rather , the site discussed another fixing called Hydroxycitric Acid that is generally found in garcinia cambogia . What's more , a few people trust that garcinia cambogia has its own weight reduction properties . In spite of the fact that , these outcomes are not decisive . In any case , nobody takes garcinia cambogia for keto ! What's more , the item additionally has "" forskolin "" in the name , so that confounds us , as well ! Basically , this simply isn't the correct element for a keto pill . Thus , don't harp excessively long on this audit page . Snap on any of the catches on this page to see a genuine keto pill !",,,
2684649280,false,finalized,3,3/13/2020 17:17:15,https://f8-text-annotation-live.s3.amazonaws.com/agg_report/2684649280/90dbda4b6438b7a41ebaf2c400bad4eaf68d0416?X-Amz-Algorithm=AWS4-HMAC-SHA256&X-Amz-Credential=AKIAIK6U7WPQWDCESAOQ%2F20200415%2Fus-east-1%2Fs3%2Faws4_request&X-Amz-Date=20200415T154556Z&X-Amz-Expires=604800&X-Amz-SignedHeaders=host&X-Amz-Signature=874765ee209523a010d21ebd7be3b61383168d67c341d32341376098f5186449,1.0,"",1.0,"",1.0,https://f8-text-annotation-live.s3.amazonaws.com/agg_report/2684649280/90dbda4b6438b7a41ebaf2c400bad4eaf68d0416?X-Amz-Algorithm=AWS4-HMAC-SHA256&X-Amz-Credential=AKIAIK6U7WPQWDCESAOQ%2F20200415%2Fus-east-1%2Fs3%2Faws4_request&X-Amz-Date=20200415T154556Z&X-Amz-Expires=604800&X-Amz-SignedHeaders=host&X-Amz-Signature=874765ee209523a010d21ebd7be3b61383168d67c341d32341376098f5186449,1.0,"",1.0,"",1.0,"",3.0,"",3.0,,,,,,,"Hi , . I was diagnosed in 2005 , I was 44 working in The Middle East . In 2006 I returned to England to see a Neurology Professor , he could not confirm Parkinson's from his examination and so , he arranged a Dat Scan which confirmed that I do have Parkinson's . However , in 2013 I met with another Neurology Professor in Singapore , he rejected the Dat Scan findings and said that I did not have the disease but , he didn't say what I had . Again I returned to England and the Neurologist told me that I have YOPD ! I have only met 3-4 other Parkinson's victims , all were older than myself . Now it seems that I am experiencing "" on - off "" symptoms and do not know what to do about it . I am living in Indonesia where there are no support groups . cookies .",,,
2684649281,false,finalized,3,3/13/2020 17:13:17,"",1.0,"",1.0,"",1.0,https://f8-text-annotation-live.s3.amazonaws.com/agg_report/2684649281/2389281253b6744d6bbb83d7788e0345476adf28?X-Amz-Algorithm=AWS4-HMAC-SHA256&X-Amz-Credential=AKIAIK6U7WPQWDCESAOQ%2F20200415%2Fus-east-1%2Fs3%2Faws4_request&X-Amz-Date=20200415T154557Z&X-Amz-Expires=604800&X-Amz-SignedHeaders=host&X-Amz-Signature=23983c882b1eecf107fa96f713d4b255c869d6f6fdd0dba3fca1ebff739547b7,0.8571,"",1.0,does_not_contain_age_mention,0.6842,"",1.8571,"",2.7143,,,,,,,"You are not alone . This was my husband's presenting symptom . I thought he just wasn't interested in me anymore ... devastating to a relationship if you haven't had a diagnosis of PD . He had stiff ankles and absolutely no interest in sex , hardly a PD diagnosis , three years to get a diagnosis . Nine years later , he still has shown no interest in sex . I dragged him to the doctor a few times and brought it up , they recommended Cialis , and he never bothered to get a prescription and never spoke of it again . He has apathy as well , which means , he doesn't give a shit that he doesn't give a shit ... so the good news is , is that you clearly do "" care "" or are able to "" care "" so I'm sure that you will do some research here and give a few things a try . Good Luck .",,,
2684649282,false,finalized,4,3/13/2020 15:49:58,"",1.0,"",1.0,"",1.0,https://f8-text-annotation-live.s3.amazonaws.com/agg_report/2684649282/158491abd873ae3c184e8d49d0eaf931709787d2?X-Amz-Algorithm=AWS4-HMAC-SHA256&X-Amz-Credential=AKIAIK6U7WPQWDCESAOQ%2F20200415%2Fus-east-1%2Fs3%2Faws4_request&X-Amz-Date=20200415T154557Z&X-Amz-Expires=604800&X-Amz-SignedHeaders=host&X-Amz-Signature=5fb975ad6dc4f76fa3e37855a073df8047d37efa50da6d23f4760a8b9d239023,0.75,"",1.0,"",1.0,does_not_contain_an_age_mention,2.0,"",4.0,,,,,,,@Melissassmile My husband @bcumsky and I want to help you raise . awareness of ANGELMAN SYNDROME . Hope you like his goofy smile ! 😜 https://t.co/V95ydEOmZG .,,,
2684649283,false,finalized,3,3/13/2020 15:41:27,"",1.0,"",1.0,"",1.0,https://f8-text-annotation-live.s3.amazonaws.com/agg_report/2684649283/51460cebbbe261849005f8c5973fc031de4cd1f9?X-Amz-Algorithm=AWS4-HMAC-SHA256&X-Amz-Credential=AKIAIK6U7WPQWDCESAOQ%2F20200415%2Fus-east-1%2Fs3%2Faws4_request&X-Amz-Date=20200415T154558Z&X-Amz-Expires=604800&X-Amz-SignedHeaders=host&X-Amz-Signature=9485a4e14626efd07a0c7a2953ea58b5b1bf35219611d8e9b5de87b682de2656,0.6667,"",1.0,"",1.0,"",3.0,"",3.0,,,,,,,"Little background : I'm currently on Tecfidera and am slightly JCV positive ( the results were indeterminate ) . I get tested every 3 months for low lymphocytes and they are always on the slightly lower end ( 14-15 from the recommended 19 minimum ) , but my neurologist always gave me the all-clear to continue the Tec . Lately , I've been having issues with balance and veering off to my left side when I walk . I have slight weakness in my left side and experience numbness in my leg and arm ( just slightly but enough ) and deal with worsening fatigue to the point of barely being able to function at work . I have also been having issues with speech and recalling words when talking at work and have a severe pain / tightening in my lower back and left shoulder . Mind you , I have always had this pain in my shoulder area ( closer to my back ) which partly lead to my MS diagnosis . I saw my neuro Monday and he's thinking it's a relapse and wants me to switch to Ocrevus after my MRI next Friday but now I'm worried . I've scoured the internet for some way to tell the difference between a relapse and PML symptoms but have come up empty handed . Am I just worrying for nothing ?",,,
2684649284,false,finalized,3,3/13/2020 17:10:03,"",1.0,"",1.0,"",1.0,https://f8-text-annotation-live.s3.amazonaws.com/agg_report/2684649284/4ed95e1ef07fdc2b5f188db7abb8f23624557c3c?X-Amz-Algorithm=AWS4-HMAC-SHA256&X-Amz-Credential=AKIAIK6U7WPQWDCESAOQ%2F20200415%2Fus-east-1%2Fs3%2Faws4_request&X-Amz-Date=20200415T154558Z&X-Amz-Expires=604800&X-Amz-SignedHeaders=host&X-Amz-Signature=380fb0d93b52f0b3fa62530d18685ef6663b22c7e55c419a07c805ee840f8006,1.0,"",1.0,"",0.6667,"",3.0,"",3.0,,,,,,,"I have relapsing MS and was diagnosed October 2018 . I was in a long distance relationship with another woman for eleven months , and it started extremely intense and affectionate and I still very much miss her even though I'm also angry and am wrapping my head around the fact that our relationship was also very much not normal ( even aside from the long distance of Boston to Vancouver ) . To console me , my best friend came over to listen to me talk and cry about it , and she told me that as early as a month after my diagnosis , my ex told her that she “ wasn't sure if she could emotionally support someone with my diagnosis ” . This was also happening at a time when I was texting her regularly and was met with silence from her for days when I was asking for any sort of attention or affection . Of course , she never expressed any of those thoughts or concerns to me . That wound up being a pattern for months , where she would like withhold any sort of attention or conversation and then make it seem like that was an unreasonable expectation in a relationship . I was just always too emotional for her to talk to . She would talk about how she was worried about me and how I needed to build a network of support otherwise , but I already had a network of support and was actively reaching out to friends and family also . I just wanted her to listen and be there for me , because she was my girlfriend . We were supposed to be a team . Is this common ? Do people frequently split after a difficult diagnosis ? I feel like this relationship made me feel crazy all the time , and I don't have a good concept of what's a reasonable expectation to have of a partner . I feel like when I asked for attention ( of any kind — not just regarding MS ) , I was treated like a nuisance or an inconvenience . I'm scared of dating again after I have some time to process this . I don't know if this is just how people are ? My dating pool is already smaller because I'm a lesbian and there's just fewer of us . I'm scared that I won't find anyone because apparently this diagnosis has made me monstrous and unwieldy .",,,
2684649285,false,finalized,3,3/13/2020 15:47:46,"",1.0,"",1.0,"",1.0,https://f8-text-annotation-live.s3.amazonaws.com/agg_report/2684649285/04f9cc2ad373a2240a1a8bb12d5cdc3ee0b35993?X-Amz-Algorithm=AWS4-HMAC-SHA256&X-Amz-Credential=AKIAIK6U7WPQWDCESAOQ%2F20200415%2Fus-east-1%2Fs3%2Faws4_request&X-Amz-Date=20200415T154559Z&X-Amz-Expires=604800&X-Amz-SignedHeaders=host&X-Amz-Signature=ea4e748eff4795376cb0fba952ff537c6473fe4c8e458564c340609e846ae49a,0,"",1.0,"",1.0,does_not_contain_an_age_mention,3.0,"",3.0,,,,,,,"Stomaching the Possibility of a Pathogenic Role for Helicobacter pylori in Parkinson ’ s Disease [ review , 2018 ]: https://content.iospress.com/articles/journal-of-parkinsons-disease/jpd181327 .",,,
2684649286,false,finalized,3,3/13/2020 17:13:21,"",1.0,"",1.0,"",1.0,https://f8-text-annotation-live.s3.amazonaws.com/agg_report/2684649286/8b7f3fd7c0e7bbde3aee6db1d9a0d184b3112410?X-Amz-Algorithm=AWS4-HMAC-SHA256&X-Amz-Credential=AKIAIK6U7WPQWDCESAOQ%2F20200415%2Fus-east-1%2Fs3%2Faws4_request&X-Amz-Date=20200415T154600Z&X-Amz-Expires=604800&X-Amz-SignedHeaders=host&X-Amz-Signature=8ef197e9e50ab3b34eafbcda2a8b4f7b4e817e4c0b1934ec974bca224ce9e8ec,1.0,"",1.0,does_not_contain_age_mention,0.6667,"",2.0,"",3.0,,,,,,,RT @djchillsnyc : Nancy sclerosis office was stormed today by patriots demanding her and her communist party to take a hike .,,,
2684649287,false,finalized,3,3/13/2020 17:11:10,https://f8-text-annotation-live.s3.amazonaws.com/agg_report/2684649287/838bea643075fca044323966f36cbec62ec1d8b5?X-Amz-Algorithm=AWS4-HMAC-SHA256&X-Amz-Credential=AKIAIK6U7WPQWDCESAOQ%2F20200415%2Fus-east-1%2Fs3%2Faws4_request&X-Amz-Date=20200415T154600Z&X-Amz-Expires=604800&X-Amz-SignedHeaders=host&X-Amz-Signature=201e341be6913e2bf0a9e2cd692e0681c65f98d1fc50169a8c2df058e90fda33,1.0,"",1.0,"",1.0,https://f8-text-annotation-live.s3.amazonaws.com/agg_report/2684649287/838bea643075fca044323966f36cbec62ec1d8b5?X-Amz-Algorithm=AWS4-HMAC-SHA256&X-Amz-Credential=AKIAIK6U7WPQWDCESAOQ%2F20200415%2Fus-east-1%2Fs3%2Faws4_request&X-Amz-Date=20200415T154600Z&X-Amz-Expires=604800&X-Amz-SignedHeaders=host&X-Amz-Signature=201e341be6913e2bf0a9e2cd692e0681c65f98d1fc50169a8c2df058e90fda33,1.0,"",1.0,"",1.0,"",3.0,"",3.0,,,,,,,"1 . Screening all donated blood for Zika virus is not cost-effective in the United States . Abstract : http://annals . org / aim / article / doi / 10 . 7326 / M18 - 2238 . Editorial : http://annals . 7326 / M18 - 3527 . URLs go live when the embargo lifts . Universal screening of individual blood donations for Zika virus , which began in 2016 , was not cost-effective in the 50 states during the first year . Widespread screening would only be cost-effective in the high mosquito season in Puerto Rico and never in the 50 states . Findings from a microsimulation study are published in Annals of Internal Medicine . The Zika epidemic of the Americas beginning in 2015 is the largest outbreak to date . Because Zika virus is associated with severe illness , such as Guillain-Barre syndrome , and potentially devastating birth defects , such as microcephaly , the U . S . Food and Drug Administration ( FDA ) implemented measures to protect transfusion recipients from infection . In 2016 , the FDA began requiring universal individual donation nucleic acid testing ( ID-NAT ) of donated blood for Zika virus in U . S . states and territories . Universal screening is still required today , although mini-pool NAT ( MP-NAT ) is permitted as of July 2018 . However , the effectiveness and cost-effectiveness of these measures had not been evaluated previously . Researchers from Stanford University , Vitalant Research Institute , and the American Red Cross used a microsimulation to estimate the effectiveness and cost-effectiveness of universal ID-NAT , universal mini-pool NAT , and alternative Zika virus screening policies in Puerto Rico and the 50 states . The microsimulation captured Zika-related harms to transfusion recipients , sexual partners , and their infants to weight the cost / benefit of universal screening . They found that during the first year of testing , screening was cost-effective only in the high mosquito season in Puerto Rico , and no evaluated screening policy was cost-effective in the 50 states . Because the Zika epidemic is largely over , screening policies are much less cost-effective today than during the period of their analysis . These findings suggest that revisiting the universal blood screening policy would be warranted . However , the authors note that many other considerations should inform blood safety policies in addition to cost-effectiveness . Media contact : For an embargoed PDF , please contact Lauren Evans at laevans@acponline.org . To interview the first author , W . Alton Russell , MS , or the senior author , Brian Custer , PhD , please contact Courtney Griggs ( Vitalant ) at CGriggs@vitalant.org or (480) 675-5754 . The media team at the American Red Cross can be reached at media@redcross.org or (202) 303-5551 . 2 . Students deliberately infected by parasite shed light on cause of Katayama syndrome . 7326 / L18 - 0438 . Katayama syndrome can occur in the absence of parasite eggs , suggesting that newly expressed antigens on developing worms may be the cause of illness . Understanding the cause of this syndrome can aid in identifying an appropriate treatment . A brief case report of students deliberately infected by schistosoma larvae is published in Annals of Internal Medicine . Katayama syndrome is a self-limited illness that occurs several weeks after infection with Schistosoma larvae . Symptoms may become severe or lead to chronic illness , so it is important to understand the root cause . Two human participants were infected with male cercariae of Schistosoma mansoni by researchers from Leiden University Medical Center . Only male parasitic worms were used so that they could not produce eggs in their hosts . Both participants developed Katayama syndrome , as evidenced by typical illnesses at the expected time after exposure , even in the absence of eggs . Based on an observation of the two participants , the researchers concluded that Katayama syndrome can present with remarkable heterogeneity in clinical signs and symptoms and may be nonspecific enough to make diagnosis difficult . According to the authors , the cases show that eosinophillia and seroconversion may become apparent after severe symptoms have subsided , that Katayama syndrome can be diagnosed as early as 5 weeks after exposure , and that it is not necessarily related to egg deposition . To interview the lead authors , please contact Sietzke Vermeulen at S.A.Vermeulen@lumc.nl . Special Section : . 3 . Annals readers share their perspectives on prescribing and recommending marijuana . Six commentaries were selected from among 100 submissions on topics ranging from marijuana policy to marijuana use during pregnancy Recently , the editors of Annals of Internal Medicine asked readers to share their perspectives on prescribing or recommending marijuana . From 100 submissions , the editors chose to publish six essays that touched on some of the most important issues that clinicians face when discussing marijuana with their patients . Commentaries featured include : . Media contact : For an embargoed PDF or author contact information for any or all of the articles , please contact Lauren Evans at laevans@acponline.org . Also New in this issue : . Beyond Pharmacotherapy : Lifestyle Counseling Guidance Needed for Hypertension . E . Amy Janke , PhD ; Caroline Richardson , MD ; Kristin L . Schneider , PhD . Ideas and Opinions . 7326 / M18 - 2361 . Service Guarantees Have a Place in Health Care . Leonard L . Berry , PhD , MBA . 7326 / M18 - 2412 . Private Equity Acquisition of Physician Practices . Lawrence P . Casalino , MD , PhD ; Rayhan Saiani , MD ; Sami Bhidya , MS ; Dhruv Khullar , MD , MPP ; Eloise O'Donnell , MPH . 7326 / M18 - 2363 .",,,
2684649288,false,finalized,3,3/13/2020 17:11:52,"",1.0,"",1.0,"",1.0,https://f8-text-annotation-live.s3.amazonaws.com/agg_report/2684649288/282428790dfe3dc91155bbdbb69e85e87fcf85ca?X-Amz-Algorithm=AWS4-HMAC-SHA256&X-Amz-Credential=AKIAIK6U7WPQWDCESAOQ%2F20200415%2Fus-east-1%2Fs3%2Faws4_request&X-Amz-Date=20200415T154601Z&X-Amz-Expires=604800&X-Amz-SignedHeaders=host&X-Amz-Signature=e65a635dcb77294b79ae0472e9c1c9ec45c010bf18a3e09367683792455fe910,0.5,"",1.0,"",0.7,"",2.8571,"",2.8571,,,,,,,"RT @EU_Brain : Tomorrow , the ' Sustainable Approach To #Depression ' report will be launched in the @Europarl_EN Interest Group on #MentalHeal … .",,,
2684649289,false,finalized,3,3/13/2020 17:10:39,https://f8-text-annotation-live.s3.amazonaws.com/agg_report/2684649289/3cbe32b06b852957efd4aae280c819d2d9248ae0?X-Amz-Algorithm=AWS4-HMAC-SHA256&X-Amz-Credential=AKIAIK6U7WPQWDCESAOQ%2F20200415%2Fus-east-1%2Fs3%2Faws4_request&X-Amz-Date=20200415T154601Z&X-Amz-Expires=604800&X-Amz-SignedHeaders=host&X-Amz-Signature=51fdf5afd3977e697972cb288ffb8c1ff623a0636c4c0096a2d9ccc8830302d9,0.8333,"",1.0,"",1.0,https://f8-text-annotation-live.s3.amazonaws.com/agg_report/2684649289/3cbe32b06b852957efd4aae280c819d2d9248ae0?X-Amz-Algorithm=AWS4-HMAC-SHA256&X-Amz-Credential=AKIAIK6U7WPQWDCESAOQ%2F20200415%2Fus-east-1%2Fs3%2Faws4_request&X-Amz-Date=20200415T154602Z&X-Amz-Expires=604800&X-Amz-SignedHeaders=host&X-Amz-Signature=dabd5f92dc441a348ef15ca24a5058c3fbd9940e75215341fec50c7ba773def4,1.0,"",1.0,"",1.0,"",0.8333,"",2.8333,,,,,,,"Hey all , 31 year old male who was diagnosed over 4 years ago currently on Gilenya . I've been taking that since the beginning , with one flare-up a few years ago . Ended up doing a methylprednisolone infusion for that . I think I've been rather lucky with my symptoms to date ( some fatigue , weakness , headaches , back pain , tingling hands ) . My most frustrating symptoms lately have been headaches and the MS Hug . But nothing keeps me from working and still staying active . I have a great support system at home , but even til today I still have some trouble talking about it with everyone because it's tough for others to totally understand everything I deal with . I was hoping to find some people on here around my age who are also dealing with MS to chat with . I could use some friends who are at the same point in their lives who are also fighting the good fight against MS . Or if anyone lives in the Buffalo , NY area , you can message me too . It's interesting to hear the experiences people have had with doctors in my area . PM me a message if you want to chat !",,,
2684649290,false,finalized,3,3/13/2020 17:11:14,https://f8-text-annotation-live.s3.amazonaws.com/agg_report/2684649290/d179b33c1ad95e34b97281a753ef026e678f9102?X-Amz-Algorithm=AWS4-HMAC-SHA256&X-Amz-Credential=AKIAIK6U7WPQWDCESAOQ%2F20200415%2Fus-east-1%2Fs3%2Faws4_request&X-Amz-Date=20200415T154602Z&X-Amz-Expires=604800&X-Amz-SignedHeaders=host&X-Amz-Signature=d41a12f6a851717622d2a1c0722debc65ceee0b2c235b441f443e5276c1830fc,1.0,"",1.0,"",1.0,https://f8-text-annotation-live.s3.amazonaws.com/agg_report/2684649290/d179b33c1ad95e34b97281a753ef026e678f9102?X-Amz-Algorithm=AWS4-HMAC-SHA256&X-Amz-Credential=AKIAIK6U7WPQWDCESAOQ%2F20200415%2Fus-east-1%2Fs3%2Faws4_request&X-Amz-Date=20200415T154603Z&X-Amz-Expires=604800&X-Amz-SignedHeaders=host&X-Amz-Signature=eb14f043cafc5ca12875a8645fa2e36daa70b0d03a936ae19d83563fa051e2a7,0.5,"",1.0,"",1.0,"",3.0,"",3.0,,,,,,,""" MS Atlas - A molecular map of brain lesion stages in progressive multiple sclerosis "" is the # 1 paper on bioRxiv today in systems biology . Congrats @Richard_001 @Burton_Recruit . See it at -> https://t.co/GIzxeIXA6G and https://t.co/nTLdG8Limz . Please retweet .",,,
2684649291,false,finalized,3,3/13/2020 17:28:32,"",1.0,"",1.0,"",1.0,https://f8-text-annotation-live.s3.amazonaws.com/agg_report/2684649291/e5832829bd3cb607bc9e07883df12a5417f31117?X-Amz-Algorithm=AWS4-HMAC-SHA256&X-Amz-Credential=AKIAIK6U7WPQWDCESAOQ%2F20200415%2Fus-east-1%2Fs3%2Faws4_request&X-Amz-Date=20200415T154603Z&X-Amz-Expires=604800&X-Amz-SignedHeaders=host&X-Amz-Signature=ff0d1964c4dcd452776da922eb83f9d24f1456534e42988c0e0f887068f7d0f5,0.5,"",1.0,"",0.6667,"",3.0,"",3.0,,,,,,,"Man , as soon as I'm in a good mood about something or just minding my own business , MS has this uncanny ability to pop up . Tonight for example , I'm reading about a themepark ride - when suddenly I see a comment from someone who says they “ Used to go on this with my Mom before she died of MS ” ... Seriously ? Can I not read about a popular mechcanical ride without it suddenly slapping me in the face with grim stuff ? Geeeeeeez . ( I'm laughing though guys ! What are the odds ? ? Surely pretty low on a thread like that ! ! ) .",,,
2684649292,false,finalized,4,3/13/2020 15:52:45,"",1.0,"",1.0,"",1.0,https://f8-text-annotation-live.s3.amazonaws.com/agg_report/2684649292/eec1740176d5a7f24b9dcb0e2798e2016193a163?X-Amz-Algorithm=AWS4-HMAC-SHA256&X-Amz-Credential=AKIAIK6U7WPQWDCESAOQ%2F20200415%2Fus-east-1%2Fs3%2Faws4_request&X-Amz-Date=20200415T154603Z&X-Amz-Expires=604800&X-Amz-SignedHeaders=host&X-Amz-Signature=12c71dde6fec30cce14bbcb581e5f26f5926c0aac4e2c8d8f2809f80b7c18662,0.5,"",1.0,"",1.0,does_not_contain_an_age_mention,2.0,"",4.0,,,,,,,"Hello Namaste , . No need to apologize for posting - this is a supportive group and most will take your concerns seriously and do their best to help . Since you have a troubled and stressed past , your symptoms could well be related to other issues . It might be helpful to focus on the four cardinal symptoms of PD : tremor , rigidity , slowness and postural instability . If you begin noticing these symptoms then a trip to a movement disorder specialist might be a good idea . Until then put the thought of Parkinson's disease out of your mind and try to live your life fully .",,,
2684649293,false,finalized,3,3/13/2020 17:11:10,"",1.0,"",1.0,"",1.0,https://f8-text-annotation-live.s3.amazonaws.com/agg_report/2684649293/fe9bae49643ba871c84b9af65f40d3eac19a7723?X-Amz-Algorithm=AWS4-HMAC-SHA256&X-Amz-Credential=AKIAIK6U7WPQWDCESAOQ%2F20200415%2Fus-east-1%2Fs3%2Faws4_request&X-Amz-Date=20200415T154604Z&X-Amz-Expires=604800&X-Amz-SignedHeaders=host&X-Amz-Signature=7864e0ae647d000af8128e74dd74d12f23c274bebf254341ac3d19b927dd6f49,0.5,"",1.0,"",0.6667,"",3.0,"",3.0,,,,,,,Tune In : Alan Alda and Michael J . Fox Swap Stories about Living with Parkinson's https://t.co/qLGpQZUYG1 .,,,
2684649294,false,finalized,3,3/13/2020 15:49:56,"",1.0,"",1.0,"",1.0,https://f8-text-annotation-live.s3.amazonaws.com/agg_report/2684649294/c832f98bc390665aab49fa25374f4bfe9a97a017?X-Amz-Algorithm=AWS4-HMAC-SHA256&X-Amz-Credential=AKIAIK6U7WPQWDCESAOQ%2F20200415%2Fus-east-1%2Fs3%2Faws4_request&X-Amz-Date=20200415T154604Z&X-Amz-Expires=604800&X-Amz-SignedHeaders=host&X-Amz-Signature=5e3bc6e4c673b2e865f8393c789c6f553db2a2e207d960298b01477290d7e17d,1.0,"",1.0,"",1.0,"",1.0,"",3.0,,,,,,,RT @1PatCaslin : Ep . 53 Health vs . Illness : Pat Caslin on Living with Multiple Sclerosis - https://t.co/AjNxENPpij .,,,
2684649295,false,finalized,3,3/13/2020 17:28:32,"",1.0,"",1.0,"",1.0,https://f8-text-annotation-live.s3.amazonaws.com/agg_report/2684649295/094d5be2e90b0381665d60dd765790cb6acd3440?X-Amz-Algorithm=AWS4-HMAC-SHA256&X-Amz-Credential=AKIAIK6U7WPQWDCESAOQ%2F20200415%2Fus-east-1%2Fs3%2Faws4_request&X-Amz-Date=20200415T154605Z&X-Amz-Expires=604800&X-Amz-SignedHeaders=host&X-Amz-Signature=4265dae20f94e0574ffe53f43df27acfb473c615c017509292360f08a34fad5a,0.5,"",1.0,"",0.6667,"",3.0,"",3.0,,,,,,,"apparently ocrevus , like rituxan , also targets t cells as well as cd20 + b cells ( based on a small study ... ): https://multiplesclerosisnewstoday.com/2019/01/15/ocrevus-depletes-t-cells-ms-patients/ .",,,
