_unit_id,_golden,_unit_state,_trusted_judgments,_last_judgment_at,annotation,annotation:confidence,annotation_1,annotation_1:confidence,annotation_2,annotation_2:confidence,annotations,annotations:confidence,contains_age_mention,contains_age_mention:confidence,does_not_contain_age_mention,does_not_contain_age_mention:confidence,does_not_contain_an_age_mention,does_not_contain_an_age_mention:confidence,doesnt_contain_age_mention,doesnt_contain_age_mention:confidence,about_patient,annotation_gold,contains_age_mention_gold,does_not_contain_age_mention_gold,mentions_disease,portal_url,text_raw,text_toks,title_raw,title_toks
2684649347,false,finalized,3,3/13/2020 17:45:31,"",1.0,"",1.0,"",1.0,https://f8-text-annotation-live.s3.amazonaws.com/agg_report/2684649347/1c70c1a01663d8eabdabaeedd68745435ce59a1f?X-Amz-Algorithm=AWS4-HMAC-SHA256&X-Amz-Credential=AKIAIK6U7WPQWDCESAOQ%2F20200415%2Fus-east-1%2Fs3%2Faws4_request&X-Amz-Date=20200415T154606Z&X-Amz-Expires=604800&X-Amz-SignedHeaders=host&X-Amz-Signature=5fbd07d7b40c858fdeb21eeb8e494589f1fd5aa5f0a338d65735a4966997d3d0,0.5,"",1.0,"",0.7059,"",1.8333,"",2.8333,,,,,,,"African-Americans in major U . S . cities are significantly more likely to live in "" trauma deserts "" with limited access to advanced emergency medical care , according to new research from the University of Chicago Medicine . The study also shows the academic medical center's new Level 1 Trauma Center led to a seven-fold reduction in Chicago's access disparity . The findings , published March 8 in the Journal of the American Medical Association's Network Open , are the first to be released about the impact of UChicago Medicine's adult Level 1 Trauma Center . Adult trauma services at the hospital began in May 2018 . "" So much of the advocacy for the trauma center was framed in terms of racial equity , "" said Elizabeth Tung , MD , MS , a primary care physician and instructor of medicine at UChicago Medicine who was the paper's first author . "" But we realized no previous studies had addressed trauma access through the lens of race / ethnicity - not just looking at Chicago , but comparing our city to other communities as well . "" The research team examined access to trauma care in Chicago , New York and Los Angeles using a geospatial analysis that compared the location of designated trauma centers with the racial and ethnic composition of the cities ' census tracts . The project included only Level 1 and Level 2 Trauma Centers , which are able to provide medical care to patients with the most serious injuries . Using a standard established in previous research from colleagues at other hospitals , the team defined a "" trauma desert "" as any urban community that is at least five miles away from advanced trauma care . While many suburban and rural communities are significantly further away from trauma care , Tung said dense urban communities must be assessed differently . "" Five miles in a rural area is probably five minutes away , but in an urban area that same distance could be 15 minutes or it could be two hours away - it entirely depends on traffic congestion , "" Tung said . "" The kind of care in urban trauma also differs from that in rural areas - the types of trauma are generally different , the patient volume is higher and the injuries are more severe . "" Trauma centers provided advanced emergency medical care for patients with critical injuries , including those from motor vehicle accidents , falls , shootings and stabbings . In Chicago , the team found that 73 percent of census tracts with a mostly black population were located in trauma deserts . Until UChicago Medicine's trauma center opened 10 months ago on its Hyde Park medical campus , residents of those communities had 8.5 times higher odds of being farther away from trauma care than people living in the city's white-majority census tracts . The new trauma center reduced this disparity by nearly 7 - fold , to 1.6 times . "" Since we opened the trauma center nearly one year ago in May , the disparity in access to adult trauma care has been significantly lessened for African-Americans in Chicago , "" said Selwyn Rogers , Jr . , MD , MPH , a professor of surgery and the director of UChicago Medicine's trauma center , which has treated more than 2,000 trauma patients . In New York City , just 14 percent of African-American communities were located in trauma deserts . In Los Angeles , 89 percent of African-American communities were located in trauma deserts , although very few census tracts in Los Angeles remain predominantly African-American . The team said Chicago's Hispanic and Latino communities were also more likely to be farther from trauma care than those living in white communities . The Hispanic and Latino disparity was not present in New York or Los Angeles . "" Even though we had a sense that this was a racially divided issue , the data confirmed that this was the case in a significant way . It was pretty startling , "" said Monica Peek , MD , MPH , an associate professor of medicine and health disparities researcher who was the senior author on the paper . UChicago Medicine has provided pediatric trauma care at Comer Children's Hospital since 1990 , but previously ended its adult trauma program in 1988 before announcing it would resume the service in 2015 in response to community requests . The hospital built a new adult emergency department , which opened in late December 2017 . Adult trauma services launched about five months later , following regulatory approval . The researchers said they hope their findings highlight the lingering impact of structural inequality in U . S . cities . They said planning for new trauma centers , which require a significant financial investment , should include an assessment of how a new facility can help address racial equity . The study , Racial and Ethnic Disparities in Geographic Access to Trauma Care : A Multiple Methods Study of U . S . Urban Trauma Centers , was supported by a grant ( 5K12HS023007 ) from the Agency for Healthcare Research and Quality . In addition to Tung , Rogers and Peek , other co-authors include : David A . Hampton , MD , MEng , from UChicago Medicine ; Marynia Kolak , PhD , MS , from the Center for Spatial Data Science at the University of Chicago ; and Joyce Yang , PhD , of the Stanford University School of Medicine .",,,
2684649348,false,finalized,3,3/13/2020 17:13:17,"",1.0,"",1.0,"",1.0,https://f8-text-annotation-live.s3.amazonaws.com/agg_report/2684649348/e146181c499f9213e2747cd8a2ed7d979ef63b44?X-Amz-Algorithm=AWS4-HMAC-SHA256&X-Amz-Credential=AKIAIK6U7WPQWDCESAOQ%2F20200415%2Fus-east-1%2Fs3%2Faws4_request&X-Amz-Date=20200415T154606Z&X-Amz-Expires=604800&X-Amz-SignedHeaders=host&X-Amz-Signature=7581fec509ce55e33f3203ea14df64f25d9953c32c46246e32a876af0852c6db,0.8571,"",1.0,does_not_contain_age_mention,0.6842,"",1.8571,"",2.7143,,,,,,,"Went the doctor for what I thought was a retinal injury ( probably a hole as I already have a weak spot and macular degeneration runs in my family ) due to losing central vision in my left eye . After all the opthamological testa they way there is nothing wrong with my retina , it actually looks pretty healthy , but my optic nerve is inflamed in only one eye . Anyone else want to tell me how long until I get diagnosed with MS from this point ? I need to have an MRI done but have to wait for an insurance issue to clear up .",,,
2684649349,false,finalized,3,3/13/2020 17:11:14,https://f8-text-annotation-live.s3.amazonaws.com/agg_report/2684649349/d844215b7e3be9eaf5fbec04535b54b8d3dcbe63?X-Amz-Algorithm=AWS4-HMAC-SHA256&X-Amz-Credential=AKIAIK6U7WPQWDCESAOQ%2F20200415%2Fus-east-1%2Fs3%2Faws4_request&X-Amz-Date=20200415T154607Z&X-Amz-Expires=604800&X-Amz-SignedHeaders=host&X-Amz-Signature=9a5fe3c45b6a22bfe01c68ef426b7060a7a14449d9c7c8bec64844a9fc011de4,1.0,"",1.0,"",1.0,https://f8-text-annotation-live.s3.amazonaws.com/agg_report/2684649349/d844215b7e3be9eaf5fbec04535b54b8d3dcbe63?X-Amz-Algorithm=AWS4-HMAC-SHA256&X-Amz-Credential=AKIAIK6U7WPQWDCESAOQ%2F20200415%2Fus-east-1%2Fs3%2Faws4_request&X-Amz-Date=20200415T154607Z&X-Amz-Expires=604800&X-Amz-SignedHeaders=host&X-Amz-Signature=9a5fe3c45b6a22bfe01c68ef426b7060a7a14449d9c7c8bec64844a9fc011de4,0.5,"",1.0,"",1.0,"",3.0,"",3.0,,,,,,,"I'm so sorry about your mom . I hope what I have is not that , I haven't found detailed info about lewy-body to understand it better and compare it with my symptoms , but from where I could gather it affects different parts of the brain and not just the sustancia nigra , and that could explain some of my symptoms , although I heard that PD patients have paresthesias as well , that's why I came here . Anyway I hope it's not that , take care .",,,
2684649350,false,finalized,3,3/13/2020 17:11:52,"",1.0,"",1.0,"",1.0,https://f8-text-annotation-live.s3.amazonaws.com/agg_report/2684649350/45bb05b604f60c34a6aa54591ea9fbb1f4c73b43?X-Amz-Algorithm=AWS4-HMAC-SHA256&X-Amz-Credential=AKIAIK6U7WPQWDCESAOQ%2F20200415%2Fus-east-1%2Fs3%2Faws4_request&X-Amz-Date=20200415T154607Z&X-Amz-Expires=604800&X-Amz-SignedHeaders=host&X-Amz-Signature=83b0c55208f49ee7501c93c356ab717d47d2fd4e9444a4765191395d28b2eaf4,1.0,"",1.0,"",0.7,"",2.8571,"",2.8571,,,,,,,"Welcome to Jim and Krista , taking over the Pedaling for Parkinson's ride , in partnership with @ParkinsonCanada . Please visit them at @P4PinPEC https://t.co/A72zMufasN .",,,
2684649351,false,finalized,3,3/13/2020 17:13:01,"",1.0,"",1.0,"",1.0,https://f8-text-annotation-live.s3.amazonaws.com/agg_report/2684649351/c5a828c298a2a813883f28515f415d6aa945f127?X-Amz-Algorithm=AWS4-HMAC-SHA256&X-Amz-Credential=AKIAIK6U7WPQWDCESAOQ%2F20200415%2Fus-east-1%2Fs3%2Faws4_request&X-Amz-Date=20200415T154608Z&X-Amz-Expires=604800&X-Amz-SignedHeaders=host&X-Amz-Signature=ff3331a65be49943c0296f03a07566308688384eee76de8dfe941fc1963cfccd,0.5,"",1.0,"",0.65,"",2.8571,"",2.8571,,,,,,,My mother-in-law has been in a rest home for a few years with Parkinson's disease . Hospice tells us today that maybe the end is near for her . Please keep our family in your prayers ! @77nateknox #prayer .,,,
2684649352,false,finalized,3,3/13/2020 17:10:03,https://f8-text-annotation-live.s3.amazonaws.com/agg_report/2684649352/f7f0f5b3897e3b89315c72d07d53fbb6c9e02bc0?X-Amz-Algorithm=AWS4-HMAC-SHA256&X-Amz-Credential=AKIAIK6U7WPQWDCESAOQ%2F20200415%2Fus-east-1%2Fs3%2Faws4_request&X-Amz-Date=20200415T154608Z&X-Amz-Expires=604800&X-Amz-SignedHeaders=host&X-Amz-Signature=0c879af28f4b2500389fa771d97fd9e3d1fac979749af4ab5ea0b230bbc4c431,1.0,"",1.0,"",1.0,https://f8-text-annotation-live.s3.amazonaws.com/agg_report/2684649352/f7f0f5b3897e3b89315c72d07d53fbb6c9e02bc0?X-Amz-Algorithm=AWS4-HMAC-SHA256&X-Amz-Credential=AKIAIK6U7WPQWDCESAOQ%2F20200415%2Fus-east-1%2Fs3%2Faws4_request&X-Amz-Date=20200415T154608Z&X-Amz-Expires=604800&X-Amz-SignedHeaders=host&X-Amz-Signature=0c879af28f4b2500389fa771d97fd9e3d1fac979749af4ab5ea0b230bbc4c431,1.0,"",1.0,"",1.0,"",3.0,"",3.0,,,,,,,Are you wearing purple today ? People with Angelman Syndrome frequently struggle with maintaining control of seizures from an early age .,,,
2684649353,false,finalized,3,3/13/2020 17:13:01,"",1.0,"",1.0,"",1.0,https://f8-text-annotation-live.s3.amazonaws.com/agg_report/2684649353/31992e7e2d3f33b1f6078178d1a3ef9c031b56b6?X-Amz-Algorithm=AWS4-HMAC-SHA256&X-Amz-Credential=AKIAIK6U7WPQWDCESAOQ%2F20200415%2Fus-east-1%2Fs3%2Faws4_request&X-Amz-Date=20200415T154609Z&X-Amz-Expires=604800&X-Amz-SignedHeaders=host&X-Amz-Signature=9762fcc8e8f8dc4a21dc4db6fb8fb62fd91795c3a2c4d63c04d31f81d75b50d6,0.5,"",1.0,"",0.65,"",2.8571,"",2.8571,,,,,,,$ BCLI Stem Cell Therapy to Treat Multiple Sclerosis https://t.co/DQzfHQrB1t $ BCLI @BrainstormCell #biotech @davidbautz #ALS https://t.co/N0FzGwOGjD .,,,
2684649354,false,finalized,3,3/13/2020 17:10:32,"",1.0,"",1.0,"",1.0,https://f8-text-annotation-live.s3.amazonaws.com/agg_report/2684649354/070809e9db2ca4cd0c6c81be4d2e501a315694c8?X-Amz-Algorithm=AWS4-HMAC-SHA256&X-Amz-Credential=AKIAIK6U7WPQWDCESAOQ%2F20200415%2Fus-east-1%2Fs3%2Faws4_request&X-Amz-Date=20200415T154556Z&X-Amz-Expires=604800&X-Amz-SignedHeaders=host&X-Amz-Signature=61608e7bfe3238acd3f38bc2e632b0d04866a52901b6f9afd94e62bc67668199,0.5,"",1.0,"",0.6667,"",3.0,"",3.0,,,,,,,"I was in a generic UK health store yesterday and noticed they now stock a supply of CBD products ; oils , serums , and creams . I try and use homeopathic therapies alongside prescribed medications ( obviously checking there are no contraindications ) and have read about CBD oil in the past and it's effectiveness in treatment with various diseases but the availability had been restricted . I was wondering if anyone used CBD oil at all as part of their symptom management and if so , what benefits do you experience personally Sorry if this has been asked before , I'm just having an MS identity crisis at the moment and need some feedback from a community who have that level of empathy with me and some validation that this isn't some snake oil I guess ! And for reference I have RRMS 6years dx Thanks for reading . Much love and top health wishes .",,,
2684649355,false,finalized,5,3/13/2020 16:06:12,"",1.0,"",1.0,"",1.0,https://f8-text-annotation-live.s3.amazonaws.com/agg_report/2684649355/7c2923775e9ccba64e990fdf45521ba3009857ef?X-Amz-Algorithm=AWS4-HMAC-SHA256&X-Amz-Credential=AKIAIK6U7WPQWDCESAOQ%2F20200415%2Fus-east-1%2Fs3%2Faws4_request&X-Amz-Date=20200415T154557Z&X-Amz-Expires=604800&X-Amz-SignedHeaders=host&X-Amz-Signature=a9c9f147f02963a7f9026fc821ad4cb9f59a7fe50492cf997e90b6713dc99bb3,0,"",1.0,"",1.0,"",4.0,"",5.0,,,,,,,"Multiple Sclerosis is a disease that can disturb the quality of life completely , the scary part is that it's not uncommon . Check for symptoms right now ! Visit : https://t.co/H3RYMtFACd .",,,
2684649356,false,finalized,4,3/13/2020 15:52:45,"",1.0,"",1.0,"",1.0,https://f8-text-annotation-live.s3.amazonaws.com/agg_report/2684649356/94898fae8ad9802d384599515618d5dcab6ef889?X-Amz-Algorithm=AWS4-HMAC-SHA256&X-Amz-Credential=AKIAIK6U7WPQWDCESAOQ%2F20200415%2Fus-east-1%2Fs3%2Faws4_request&X-Amz-Date=20200415T154557Z&X-Amz-Expires=604800&X-Amz-SignedHeaders=host&X-Amz-Signature=e69851fc61d8c71fb021b02fe18ad00574fd91a81ee141b6549fbf64bd090021,0.5,"",1.0,"",1.0,does_not_contain_an_age_mention,2.0,"",4.0,,,,,,,"Thank you , Kathrynne . I had contacted my MDS and am up one more dose ( to equal 4 , every four hours from 8: 00 a . m . to 8: 00 pm , and I went up to 2 25/100 tablets per dose . The first few days were pretty shaky , but things have settled down and am doing much better . However , I've developed something going on with my knees that makes it painful to walk . I had cortisone shots last Friday that helped for about five days ( x-rays found arthritis under my kneecap ) , but now the pain is back . Will be seeing my MDS on 13th and will try to figure out what is going on . I appreciate your thoughts on kefir , too . Thanks ! Linda .",,,
2684649357,false,finalized,3,3/13/2020 17:13:21,"",1.0,"",1.0,"",1.0,https://f8-text-annotation-live.s3.amazonaws.com/agg_report/2684649357/eedcc04cf041039e10af8d7267cdf012f360768b?X-Amz-Algorithm=AWS4-HMAC-SHA256&X-Amz-Credential=AKIAIK6U7WPQWDCESAOQ%2F20200415%2Fus-east-1%2Fs3%2Faws4_request&X-Amz-Date=20200415T154558Z&X-Amz-Expires=604800&X-Amz-SignedHeaders=host&X-Amz-Signature=50fb4aa74b73433ac75d6f33725f52f6e318c3533783933b0c9e9c31008e8933,1.0,"",1.0,does_not_contain_age_mention,0.6667,"",2.0,"",3.0,,,,,,,"IMAGE : A nanometer-sized pNT cylinder made of 40 benzenes . The cylinder is tens of thousands of times thinner than a human hair . Credit : ( c ) 2018 Hiroyuki Isobe . For the first time , researchers used benzene - a common hydrocarbon - to create a novel kind of molecular nanotube , which could lead to new nanocarbon-based semiconductor applications . Researchers from the Department of Chemistry have been hard at work in their recently renovated lab in the University of Tokyo's Graduate School of Science . The pristine environment and smart layout affords them ample opportunities for exciting experiments . Professor Hiroyuki Isobe and colleagues share an appreciation for "" beautiful "" molecular structures and created something that is not only beautiful but is also a first for chemistry . Their phenine nanotube ( pNT ) is beautiful to see for its pleasing symmetry and simplicity , which is a stark contrast to its complex means of coming into being . Chemical synthesis of nanotubes is notoriously difficult and challenging , even more so if you wish to delicately control the structures in question to provide unique properties and functions . Typical carbon nanotubes are famous for their perfect graphite structures without defects , but they vary widely in length and diameter . Isobe and his team wanted a single type of nanotube , a novel form with controlled defects within its nanometer-sized cylindrical structure allowing for additional molecules to add properties and functions . The researchers ' novel process of synthesis starts with benzene , a hexagonal ring of six carbon atoms . They use reactions to combine six of these benzenes to make a larger hexagonal ring called a cyclo-meta-phenylene ( CMP ) . Platinum atoms are then used which allow four CMPs to form an open-ended cube . When the platinum is removed , the cube springs into a thick circle and this is furnished with bridging molecules on both ends enabling the tube shape . It sounds complicated , but amazingly , this complex process successfully bonds the benzenes in the right way over 90 percent of the time . The key also lies in the symmetry of the molecule , which simplifies the process to assemble as many as 40 benzenes . These benzenes , also called phenines , are used as panels to form the nanometer-sized cylinder . The result is a novel nanotube structure with intentional periodic defects . Theoretical investigations show these defects imbue the nanotube with semiconductor characters . "" A crystal of pNT is also interesting : The pNT molecules are aligned and packed in a lattice rich with pores and voids , "" Isobe explains . "" These nanopores can encapsulate various substances which imbue the pNT crystal with properties useful in electronic applications . One molecule we successfully embedded into pNT was a large carbon molecule called fullerene ( C70 ) . "" "" A team lead by Kroto / Curl / Smalley discovered fullerenes in 1985 . It is said that Sir Harold Kroto fell in love with the beautiful molecule , "" continues Isobe . "" We feel the same way about pNT . We were shocked to see the molecular structure from crystallographic analysis . A perfect cylindrical structure with fourfold symmetry emerges from our chemical synthesis . "" "" After a few decades since the discovery , this beautiful molecule , fullerene , has found various utilities and applications , "" adds Isobe . "" We hope that the beauty of our molecule is also pointing to unique properties and useful functions waiting to be discovered . "" Zhe Sun , Koki Ikemoto , Toshiya M . Fukunaga , Takashi Koretsune , Ryotaro Arita , Sota Sato and Hiroyuki Isobe . Finite phenine nanotubes with periodic vacancy defects . DOI : 10.1126 / science . Laboratory of Physical Organic Chemistry - http://www . s . u-tokyo . jp / users / physorg / . Department of Chemistry - http://www . jp / en . Graduate School of Science - https :/ / www . jp / en / . ERATO Isobe Degenerate π-Integration Project - http://www . jp / erato / isobe / en / index . Professor Hiroyuki Isobe . Department of Chemistry , Graduate School of Science , The University of Tokyo . 7-3- 1 Hongo , Bunkyo-ku , Tokyo 113-0033 JAPAN . Tel : +81-3- 5841-4777 . Email : isobe@chem.s.u-tokyo.ac.jp . Ms . Kristina Awatsu . Office of Communication , Graduate School of Science , The University of Tokyo . Tel : +81-3- 5841-8737 . E-mail : kouhou.s@gs.mail.u-tokyo.ac.jp . Mr . Rohan Mehra . Division for Strategic Public Relations , The University of Tokyo . 7-3- 1 Hongo , Bunkyo-ku , Tokyo 113-8654 JAPAN . Tel : +81-3- 5841-0876 . Email : press-releases . About the University of Tokyo . The University of Tokyo is Japan's leading university and one of the world's top research universities . The vast research output of some 6,000 researchers is published in the world's top journals across the arts and sciences . Our vibrant student body of around 15,000 undergraduate and 15,000 graduate students includes over 2,000 international students . Find out more at https :/ / www . jp / en / or follow us on Twitter at @UTokyo_News_en .",,,
2684649358,false,finalized,3,3/13/2020 17:10:03,"",1.0,"",1.0,"",1.0,https://f8-text-annotation-live.s3.amazonaws.com/agg_report/2684649358/b0e8521503d2caa63ce701aa677724a86fd689e3?X-Amz-Algorithm=AWS4-HMAC-SHA256&X-Amz-Credential=AKIAIK6U7WPQWDCESAOQ%2F20200415%2Fus-east-1%2Fs3%2Faws4_request&X-Amz-Date=20200415T154559Z&X-Amz-Expires=604800&X-Amz-SignedHeaders=host&X-Amz-Signature=c01496e3ef44581e3858266a093af9ba86590c0a36d6a8ae08aae602796b7df8,1.0,"",1.0,"",0.6667,"",3.0,"",3.0,,,,,,,@JacobAWohl Absolutely wrong ... Try having multiple sclerosis and tell me that .,,,
2684649359,false,finalized,5,3/13/2020 16:06:12,"",1.0,"",1.0,"",1.0,https://f8-text-annotation-live.s3.amazonaws.com/agg_report/2684649359/79679ee24f0349bb8024bdb736ff5a04f837fa76?X-Amz-Algorithm=AWS4-HMAC-SHA256&X-Amz-Credential=AKIAIK6U7WPQWDCESAOQ%2F20200415%2Fus-east-1%2Fs3%2Faws4_request&X-Amz-Date=20200415T154600Z&X-Amz-Expires=604800&X-Amz-SignedHeaders=host&X-Amz-Signature=f3ea5a3bab20c0aed44c9fbfd6b90d5ee46334992ef1826457443ce9df35e509,0.6,"",1.0,"",1.0,"",4.0,"",5.0,,,,,,,"There ’ s only ONE MONTH left before applications close for the CCK Angelman Family Retreat Weekend ! If you haven ’ t started your application yet , this is your chance ! Start here : www.angelman.org/event/center-for-courageous-kids-2018 . This camp experience unlike any other is FREE * for families to attend — October 19-21 in Scottsville , Kentucky . Bring the whole family to enjoy activities like archery , bowling and horseback riding . * While there is no charge to families for the camp weekend experience , families must provide their own transportation and travel costs to and from the camp .",,,
2684649360,false,finalized,3,3/13/2020 15:41:27,"",1.0,"",1.0,"",1.0,https://f8-text-annotation-live.s3.amazonaws.com/agg_report/2684649360/4c49670fc7e494e5fe5919317f6e4fd4e9d5103e?X-Amz-Algorithm=AWS4-HMAC-SHA256&X-Amz-Credential=AKIAIK6U7WPQWDCESAOQ%2F20200415%2Fus-east-1%2Fs3%2Faws4_request&X-Amz-Date=20200415T154600Z&X-Amz-Expires=604800&X-Amz-SignedHeaders=host&X-Amz-Signature=7ceae3d855a217c05fa59605d7f82d67dc5d9e24812880c98c6ae984e1c1d09b,0.6667,"",1.0,"",1.0,"",3.0,"",3.0,,,,,,,"UBE 3A Gene Reactivation Restores Neuron Physiology , But Not Behavioral Defects - Angelman Syndrome News https://t.co/pHXRfCT00Z .",,,
2684649361,false,finalized,3,3/13/2020 17:11:14,https://f8-text-annotation-live.s3.amazonaws.com/agg_report/2684649361/9a70737a4cb3c60dbb4208685d1cbaaa1a646749?X-Amz-Algorithm=AWS4-HMAC-SHA256&X-Amz-Credential=AKIAIK6U7WPQWDCESAOQ%2F20200415%2Fus-east-1%2Fs3%2Faws4_request&X-Amz-Date=20200415T154601Z&X-Amz-Expires=604800&X-Amz-SignedHeaders=host&X-Amz-Signature=67330e37091fed4454ee4c4d0fc748b82378f66f56e025dd0518b2f8f4b5b4d7,1.0,"",1.0,"",1.0,https://f8-text-annotation-live.s3.amazonaws.com/agg_report/2684649361/9a70737a4cb3c60dbb4208685d1cbaaa1a646749?X-Amz-Algorithm=AWS4-HMAC-SHA256&X-Amz-Credential=AKIAIK6U7WPQWDCESAOQ%2F20200415%2Fus-east-1%2Fs3%2Faws4_request&X-Amz-Date=20200415T154601Z&X-Amz-Expires=604800&X-Amz-SignedHeaders=host&X-Amz-Signature=67330e37091fed4454ee4c4d0fc748b82378f66f56e025dd0518b2f8f4b5b4d7,0.5,"",1.0,"",1.0,"",3.0,"",3.0,,,,,,,"Retro Lean Garcinia building Muscle fast is all approximately intensity . Muscle builds because of stimulation inflicting sufficient pressure that the muscle is compelled to adapt and grow . typically that is achieved by means of lifting weights within a sure rep range . The maximum not unusual one used by bodybuilders is inside the 10-12 range for maximum muscle groups although larger stages along with 15-25 can be used for the legs and abs . Of route the most extreme weight lifting physical games involve isometrics , where the resistance is so great no motion takes area . not anything gets effects quicker and by the time you've got completed reading this newsletter you'll understand why . The reason bodybuilders paintings within the above 10-12 rep variety is to fatigue the glycogen shops in the muscle tissues ( its energy reserves ) and motive slight tearing of the muscle groups because of increased blood float . This minor damage reasons the muscle to breakdown and rebuild itself more potent and bigger .",,,
