_unit_id,_golden,_unit_state,_trusted_judgments,_last_judgment_at,annotation,annotation:confidence,annotation_1,annotation_1:confidence,annotation_2,annotation_2:confidence,annotations,annotations:confidence,contains_age_mention,contains_age_mention:confidence,does_not_contain_age_mention,does_not_contain_age_mention:confidence,does_not_contain_an_age_mention,does_not_contain_an_age_mention:confidence,doesnt_contain_age_mention,doesnt_contain_age_mention:confidence,about_patient,annotation_gold,contains_age_mention_gold,does_not_contain_age_mention_gold,mentions_disease,portal_url,text_raw,text_toks,title_raw,title_toks
2684649312,false,finalized,5,3/13/2020 16:06:12,"",1.0,"",1.0,"",1.0,https://f8-text-annotation-live.s3.amazonaws.com/agg_report/2684649312/2f1a059b37ed8ffb162a54a7ad16bc9fcbab1923?X-Amz-Algorithm=AWS4-HMAC-SHA256&X-Amz-Credential=AKIAIK6U7WPQWDCESAOQ%2F20200415%2Fus-east-1%2Fs3%2Faws4_request&X-Amz-Date=20200415T154600Z&X-Amz-Expires=604800&X-Amz-SignedHeaders=host&X-Amz-Signature=ebb992b81334879be7b1b12c4610887aaaf524bf4bff3f53b1f20ddc2dd2b4f9,0,"",1.0,"",1.0,"",5.0,"",5.0,,,,,,,"My Neurologist is 95 % certain at this point I have MS . I have scattered foci on my brain and fit all the other criteria although my spinal tap was OK . I have lyme and that has complicated diagnosis . Mycoplasma levels are hard to control and one non lyme specific issue is my white blood cell count has been high for 3 years can anyone please tell me if this is common with ms ? I am having the visual test again and mri of spine . Last opthamologist appointment I was told I had occular rosacea ? and by chance had missed one of the color charts red plate . 4 months prior I had no issues . Since the birth of my son ( surprise baby ) I have been on a downward spiral . Pain , balance , muscle spasms , walking issues , tremors , sleep issues and fatigue . I take medication to help but not much seems to help provigil is not too helpful anymore . I have severe neck pain and back pain . I take hydrocodone Ibuprofen , clonipin ( sp ? ) Lyrica , medication for arthritis , antibiotics , sleeping meds ... you name it . I think the side effects are awful but not taking them would be worse . Lots of the meds have caused weight gain and although a small issue it bothers me . I suffer incontinence in bouts also have bowel issues . I have numbness and tingling and am very weak . I try to exercise but it leaves me suffering for days after . If the tests being peformed now are negative my neuro wants to send me to UVA to specialist . After all the docs I was reserved to go to yet another dr but at this point I know I have to and will run there if I have to . For the first time in my life I have ADD . I cannot focus have issue with word finding and just feel like a doofus sometimes . Reading and keeping on the same line is tough . I am so blessed in so many ways I have wonderful children but it is a challenge with the baby . On antibiotics all this time surely my count should be normal or low ! ? Thank you for any help you can offer .",,,
2684649313,false,finalized,3,3/13/2020 17:13:17,"",1.0,"",1.0,"",1.0,https://f8-text-annotation-live.s3.amazonaws.com/agg_report/2684649313/744d8d2a4aea15b24ba63d1ceea9c36acd5aed53?X-Amz-Algorithm=AWS4-HMAC-SHA256&X-Amz-Credential=AKIAIK6U7WPQWDCESAOQ%2F20200415%2Fus-east-1%2Fs3%2Faws4_request&X-Amz-Date=20200415T154600Z&X-Amz-Expires=604800&X-Amz-SignedHeaders=host&X-Amz-Signature=c780489b28f87306507fc5f3a235c592c09291405fba3c800a25f29399001de7,0.8571,"",1.0,does_not_contain_age_mention,0.6842,"",1.8571,"",2.7143,,,,,,,Lives are ruined by shame and stigma . LGBT lessons in schools are vital   . Hannah Jane Parkinson   . The Guardian https://t.co/REM84OWgtm .,,,
2684649314,false,finalized,3,3/13/2020 17:11:10,"",1.0,"",1.0,"",1.0,https://f8-text-annotation-live.s3.amazonaws.com/agg_report/2684649314/906d147bd92eb1e48ec92984d4d0fb37dcd6f73b?X-Amz-Algorithm=AWS4-HMAC-SHA256&X-Amz-Credential=AKIAIK6U7WPQWDCESAOQ%2F20200415%2Fus-east-1%2Fs3%2Faws4_request&X-Amz-Date=20200415T154601Z&X-Amz-Expires=604800&X-Amz-SignedHeaders=host&X-Amz-Signature=24fddae17db246218b1cb0542fc89e889802aea2b4f3ccd5cc5670cd043fe2e7,0.5,"",1.0,"",0.6667,"",3.0,"",3.0,,,,,,,"Anyone else on ocrevus experienced this ? I never use to get sunburnt , could go out without sunscreen and end up just darkly tanned . Since I've completed my first does , my skin seems extra sensitive . Lipsticks I use to love now feel like they burn my lips . I was out at the beach Friday with a good amount of sunscreen on and reapplied every 20 minutes and I ended up with a severely patchy sunburn , with some spots bordering 3rd degree burns . After only 2 hours in the sun . I use to spend an entire day ( sun up to sun down ) at the beach without sunscreen at all . Not sure it's it's a body change due to the medication or something completely unrelated . Just wanted to know if anyone else experienced something like this .",,,
2684649315,false,finalized,3,3/13/2020 15:47:46,"",1.0,"",1.0,"",1.0,https://f8-text-annotation-live.s3.amazonaws.com/agg_report/2684649315/9908a0b1d38ffdec9d4f2f7893429a174e7168af?X-Amz-Algorithm=AWS4-HMAC-SHA256&X-Amz-Credential=AKIAIK6U7WPQWDCESAOQ%2F20200415%2Fus-east-1%2Fs3%2Faws4_request&X-Amz-Date=20200415T154602Z&X-Amz-Expires=604800&X-Amz-SignedHeaders=host&X-Amz-Signature=9dc83618b39ae41851970222bd1fe3c35df8449ef1a396b6f74a25347cc08fca,0,"",1.0,"",1.0,does_not_contain_an_age_mention,3.0,"",3.0,,,,,,,Parkinson's Law - From the archive https://t.co/8PgLqQXKAB .,,,
2684649316,false,finalized,3,3/13/2020 17:14:04,https://f8-text-annotation-live.s3.amazonaws.com/agg_report/2684649316/95a7fbb338761b9204411b9bb3042155041d19b1?X-Amz-Algorithm=AWS4-HMAC-SHA256&X-Amz-Credential=AKIAIK6U7WPQWDCESAOQ%2F20200415%2Fus-east-1%2Fs3%2Faws4_request&X-Amz-Date=20200415T154602Z&X-Amz-Expires=604800&X-Amz-SignedHeaders=host&X-Amz-Signature=84b855281953b4c13e3c13384b91f7ab8ffe3499f10e17cadc650d6afe3ff6c6,1.0,"",1.0,"",1.0,https://f8-text-annotation-live.s3.amazonaws.com/agg_report/2684649316/95a7fbb338761b9204411b9bb3042155041d19b1?X-Amz-Algorithm=AWS4-HMAC-SHA256&X-Amz-Credential=AKIAIK6U7WPQWDCESAOQ%2F20200415%2Fus-east-1%2Fs3%2Faws4_request&X-Amz-Date=20200415T154602Z&X-Amz-Expires=604800&X-Amz-SignedHeaders=host&X-Amz-Signature=84b855281953b4c13e3c13384b91f7ab8ffe3499f10e17cadc650d6afe3ff6c6,1.0,"",1.0,"",0.6667,"",2.0,"",3.0,,,,,,,In the most simplest terms ? I was watching a University WebCast on MS and some neurologist / researcher mentioned that people with MS have high amounts of Autoantibodies and low amounts of Lymphocytes . He said this will be the next step in developing new medication . What does this all mean ( Autoantibodies ) ? ?,,,
2684649317,false,finalized,3,3/13/2020 17:13:17,"",1.0,"",1.0,"",1.0,https://f8-text-annotation-live.s3.amazonaws.com/agg_report/2684649317/621a13d73208e48bebbd476d8e331a04782cfc64?X-Amz-Algorithm=AWS4-HMAC-SHA256&X-Amz-Credential=AKIAIK6U7WPQWDCESAOQ%2F20200415%2Fus-east-1%2Fs3%2Faws4_request&X-Amz-Date=20200415T154603Z&X-Amz-Expires=604800&X-Amz-SignedHeaders=host&X-Amz-Signature=b922a38d31e0a74b3d763d8849cf10b625a3b4a8d9c17c9b3d6dc378a9b1eae7,0.8571,"",1.0,does_not_contain_age_mention,0.6842,"",1.8571,"",2.7143,,,,,,,"Hello . First of all , thank you for taking time to read this . I realize you are probably not a MD . I have seen MDs for the below described issues and would like to ask \ * non \ * - medical professionals with real-world experience . 35m here . tldr is below but a full read may help in offering the best insight . In August 2018 I had my tonsils removed . One month after this my soft palate descended in my mouth which gave me sleep-onset hypnic jerks . It was a terrible experience . My doctor prescribed . 5mg Etizolam three times daily ( I live in Japan where it is legal ) to help me get sleep . I wanted to be careful with the benzo-derivative so I only took one pill daily 30 min before going to bed . Etizolam helped a great deal and although I was careful with it , it was not mentally taxing or worrisome for me . Mid-November I noticed a tremor in my right pinky when my hand was held out and also a tremor in my left ring and pinky finger . I tapered the Etizolam and the tremor persisted and spread through my body ( lips , tongue , toes ) . As I was undergoing anxiety I am willing to attribute those tremors to simply that , stress / anxiety . I visited a neurologist who gave me an MRI immediately . No visible problems were evident . He asked me to wait two weeks and see . I waited two weeks and saw him again at which point the tremors had left my body but remained in my hands ( although to a lesser degree ) while also extending to my wrists and elbows . He said since the other tremors had gone I should wait and see if this was simply a withdrawal of Etizolam and he asked to see me in March 2019 . This was mid-December . On December 21st I began to have UTI-like symptoms . They were simple at first , a sensation of needing to visit the restroom ever-so-slightly more than usual . I saw a urologist that day and he said my urinalysis was clean . Dec . 23rd the slight urge persisted so I saw another GP , same result . Dec 26th visiting family in the States I was now having serious urges to void as soon as 10 minutes after voiding so I saw a urologist . Dx'd prostatitis and gave me a week of antibiotics . I felt better for a day then proceeded to get much , much worse . Dec 29th on what was supposed to be a surprise family trip to Disney World I had to be taken off the plane in Orlando and taken to a hospital I was in such pain and voiding so frequently . They CT'd and found no severe problems . Possible cystitis and suggested I get a cystoscopy . Dec 30th I woke up feeling okay but by 10AM I was attached by the hip to a toilet and experiencing pain in my urethra . That night I experienced mind-numbing frequency , urgency and pain . I could not think about anything other than voiding for hours on hours . Dec 31st , after a voiding around 10AM the symptoms slowly vanished . I'll leave out details of how I thought I was fine and came down with norovirus two days later putting a cap on the nightmare ' vacation ' . During this time my tremors in my fingers ( mostly dominant right hand ) seemed to settle as did tremors in my right wrist . There were now periods of the days where I could hold out my hand and pivot my wrists up and down without noticing a tremor throughout my hand . Slight tremors in my arms ( from elbow to fingertips ) persisted when I held my arms above my head or rest my elbows on a table and grasp my hands in front of me . January 11th , I noticed increasing trips to the bathroom . January 12th . From 2am - 9am I voided 9 times . Went back to local urologist in Japan , did an ultrasound and despite everything looking ' the right size ' he said could indeed be prostatitis and gave me the Japanese equivalent of Cialis . Symptoms began to taper that evening and through the next day . January 14th I felt completely like my old self . From around January 14th I was also able to hold my fingers straight and sometimes if I hold my fingers out but don't concentrate or try to force them straight , they easily stay straight . Just the same I visited a specialist for Interstitial Cystitis and he scheduled me for a cystoscopy . January 17th the urgency came back the morning of the cystoscopy . The cystoscopy looked great I have a healthy-looking bladder . tldr : Late November : Slight tremors in fingers and body . Eventually settling in fingers , wrists and arms at elbows . December : Reduction in tremor throughout body but remaining in fingers , hands , arms . Increasing urgency over ten-day period resulting in , ultimately , severe pain / burning and \ * \ * \ * constant \ * \ * \ * urge to void that vanished over 12hr window . January : Return of urinary urge symptoms but the length of symptoms is greatly reduced while on Cialis equivalent ( possible reaction to diet that is kind to bladder ) Periods of reduced tremor activity in fingers throughout the day are observed . Improvement in wrist tremor ( even during high stress periods ) Arm / elbow tremors persist . I have been through a plethora of Dr . Google searches , and more doctor visits than are listed even in the detailed explanation and two potential answers that keep popping up are PD or MSA which my doctors are dismissing ( understandably but simultaneously frustratingly so ) . Yet reading so many personal accounts online seem to keep pointing me back in that direction . Does the speed of these symptoms seem to match with PD onset ? I realize everyone is a unique case but is a barely three-month window just too unlikely for the speed at which something like PD would act on multiple systems in a patient ? I appreciate your time and consideration in replying .",,,
2684649318,false,finalized,3,3/13/2020 17:17:15,"",1.0,"",1.0,"",1.0,https://f8-text-annotation-live.s3.amazonaws.com/agg_report/2684649318/067a0ce5196d3f7ecb00c907289f185844cee7ba?X-Amz-Algorithm=AWS4-HMAC-SHA256&X-Amz-Credential=AKIAIK6U7WPQWDCESAOQ%2F20200415%2Fus-east-1%2Fs3%2Faws4_request&X-Amz-Date=20200415T154603Z&X-Amz-Expires=604800&X-Amz-SignedHeaders=host&X-Amz-Signature=0270739f0f7f6e55d0fa7f15fd8a111d04118247bddb1941d4f2e91e0368eade,0.5,"",1.0,"",0.6667,"",3.0,"",3.0,,,,,,,NEXT WEEK ! Santa Monica #Parkinsons Round Table Meeting 1/17 / 19 https://t.co/rtzQExSuJO .,,,
2684649319,false,finalized,3,3/13/2020 17:11:14,https://f8-text-annotation-live.s3.amazonaws.com/agg_report/2684649319/7ca073e46ac70192a7da17e9c0786eb637ee81c7?X-Amz-Algorithm=AWS4-HMAC-SHA256&X-Amz-Credential=AKIAIK6U7WPQWDCESAOQ%2F20200415%2Fus-east-1%2Fs3%2Faws4_request&X-Amz-Date=20200415T154603Z&X-Amz-Expires=604800&X-Amz-SignedHeaders=host&X-Amz-Signature=93147dd9eef360836710fdc722ba701acabe4cbb7f468661c74d96bcb607b7c0,1.0,"",1.0,"",1.0,https://f8-text-annotation-live.s3.amazonaws.com/agg_report/2684649319/7ca073e46ac70192a7da17e9c0786eb637ee81c7?X-Amz-Algorithm=AWS4-HMAC-SHA256&X-Amz-Credential=AKIAIK6U7WPQWDCESAOQ%2F20200415%2Fus-east-1%2Fs3%2Faws4_request&X-Amz-Date=20200415T154604Z&X-Amz-Expires=604800&X-Amz-SignedHeaders=host&X-Amz-Signature=15019e0c639f457c0fd2db06ee55d231d7ff5d861ba49a4ca6fc458915076a89,0.5,"",1.0,"",1.0,"",3.0,"",3.0,,,,,,,"While not well known , this test can detect embryos destined to develop Angelman syndrome . As early as 10 weeks post conception . Very early detection is now possible . Motivates need for very early treatment . We are working hard to develop , but need funding to accelerate efforts . https://t.co/jHH4YpaLMU .",,,
2684649320,false,finalized,3,3/13/2020 17:17:15,"",1.0,"",1.0,"",1.0,https://f8-text-annotation-live.s3.amazonaws.com/agg_report/2684649320/c2cf371cdc5e9870e99ebf7c9524261ef61b7737?X-Amz-Algorithm=AWS4-HMAC-SHA256&X-Amz-Credential=AKIAIK6U7WPQWDCESAOQ%2F20200415%2Fus-east-1%2Fs3%2Faws4_request&X-Amz-Date=20200415T154604Z&X-Amz-Expires=604800&X-Amz-SignedHeaders=host&X-Amz-Signature=1262ec6674e8b6aa9ddb6a5aed05694dfc6007a19555022ab11cfe357e7f6180,0.5,"",1.0,"",0.6667,"",3.0,"",3.0,,,,,,,@The42_ie Read my PLEA PLEASE HELP ME I'm DYING from MULTIPLE SCLEROSIS and I OWE € 16500 in RENT ARREARS and my BILLS PLEASE HELP me PLEASE Bank Details are on MY PLEA IM CRYING and BEGGING for HELP PLEASE HELP ME PLEASE PLEASE HELP ME NOW I NEED HELP NOW .,,,
2684649321,false,finalized,3,3/13/2020 17:11:52,"",1.0,"",1.0,"",1.0,https://f8-text-annotation-live.s3.amazonaws.com/agg_report/2684649321/45ad821cea5bb095fa11e7b76b876167a7b2ee8f?X-Amz-Algorithm=AWS4-HMAC-SHA256&X-Amz-Credential=AKIAIK6U7WPQWDCESAOQ%2F20200415%2Fus-east-1%2Fs3%2Faws4_request&X-Amz-Date=20200415T154605Z&X-Amz-Expires=604800&X-Amz-SignedHeaders=host&X-Amz-Signature=fbff9d744228dbc872787beda68a251d5708740fa4b5e345eeec3956958220fd,1.0,"",1.0,"",0.7,"",2.8571,"",2.8571,,,,,,,"Other noninfectious inflammatory disorders . - Multiple Sclerosis Discovery Forum . Multiple Sclerosis Discovery Forum . User Top Menu . * Welcome , guest . * Log In . * Why Join ? * About Us . * News & Future Directions . * Professional Resources . * Research Resources . * Click Here to Support MSDF . You are here . * Editors ' Picks . * Classic Papers . + Current Week . + 6 May 2016 - 13 May 2016 . + 26 Apr 2016 - 3 May 2016 . + 18 Apr 2016 - 25 Apr 2016 . Rovira Á , Auger C , Rovira A . Handb Clin Neurol . 2016 ; 135:425- 46 . PMID : 2743267 7 . The Authors in . Most Popular Papers . * Commented On . In vivo clonotypic regulation of human myelin basic protein-reactive T cells by T cell vaccination . Interferon-beta - 1b - induced short - and long-term signatures of treatment activity in multiple sclerosis . Significant Reduced Loss of Brain Volume in Multiple Sclerosis Patients Treated with COPAXONE ( R ) . Commentary : Outcome measures were flawed . Sanofi's history . See Full List . E-mail statistics unavailable . Search Papers Archive . Words in title / abstract . Include comments in search Exclude comments in search Search only comments . Papers by the week All . Year 2019 2018 2017 2016 2015 2014 2013 2012 2011 2010 2009 2008 2007 2006 2005 2004 2003 2002 2001 2000 1999 1998 1997 1996 1995 1994 1993 1992 1991 1990 1989 1988 1987 1986 1985 1984 1983 1982 1981 1980 1979 1978 1977 1976 1975 1974 1973 1972 1971 1970 1969 1968 1967 1966 1965 1964 1963 1962 1961 1960 1959 1958 1957 1956 1955 1954 1953 1952 1951 1950 . Month Jan Feb Mar Apr May Jun Jul Aug Sep Oct Nov Dec . Copyright © 2014 MGH and ACP . * Terms of Use . * How to Cite . * Site Map . * Support Us . * Image Credits . All site content , except where otherwise noted , is licensed under a Creative Commons BY license . Please let us know where and how you use MSDF material .",,,
2684649322,false,finalized,3,3/13/2020 15:41:27,"",1.0,"",1.0,"",1.0,https://f8-text-annotation-live.s3.amazonaws.com/agg_report/2684649322/1095623c75835039577f87ea656831bfde620889?X-Amz-Algorithm=AWS4-HMAC-SHA256&X-Amz-Credential=AKIAIK6U7WPQWDCESAOQ%2F20200415%2Fus-east-1%2Fs3%2Faws4_request&X-Amz-Date=20200415T154605Z&X-Amz-Expires=604800&X-Amz-SignedHeaders=host&X-Amz-Signature=50079878eed1cb99c60a6d7952621a0819826bb533ebb4237d548ac2dab5c97f,0.6667,"",1.0,"",1.0,"",3.0,"",3.0,,,,,,,"This narrative from the @jeremycorbyn fans is getting tired . @MLewisLawyer has multiple sclerosis , whilst on heavy pain meds he was being told to get “ back into the oven ” etc by Neo Nazis , he quite understandably told them to “ f off ” - he was fined for this . Which is ridiculous .",,,
2684649323,false,finalized,3,3/13/2020 17:10:32,"",1.0,"",1.0,"",1.0,https://f8-text-annotation-live.s3.amazonaws.com/agg_report/2684649323/3ee280c73b0f1d7b6a9889b16938c4656935f81a?X-Amz-Algorithm=AWS4-HMAC-SHA256&X-Amz-Credential=AKIAIK6U7WPQWDCESAOQ%2F20200415%2Fus-east-1%2Fs3%2Faws4_request&X-Amz-Date=20200415T154605Z&X-Amz-Expires=604800&X-Amz-SignedHeaders=host&X-Amz-Signature=5c7a17e907d451e45bc814abff59f0638701102c0949a990d12f5c35ddbfd3a1,0.5,"",1.0,"",0.6667,"",3.0,"",3.0,,,,,,,Coming Soon : Full Spectrum Ultra Premium CBD Extract . 🌿 . Suggested usage for the following : . - Cancerous tumors   . Parkinson's   . Inflammation   . Stomach issues . • . #fullspectrum #ultrapremium #cbdextract #cbdoil #cbd #cancersucks #calming #cbdrelief #naturalrelief #chronicpain https://t.co/h69WwI296x .,,,
2684649324,false,finalized,4,3/13/2020 15:40:24,"",1.0,"",1.0,"",1.0,https://f8-text-annotation-live.s3.amazonaws.com/agg_report/2684649324/ad905a831ac8fb34789d2d967b62ea27c5ba92ff?X-Amz-Algorithm=AWS4-HMAC-SHA256&X-Amz-Credential=AKIAIK6U7WPQWDCESAOQ%2F20200415%2Fus-east-1%2Fs3%2Faws4_request&X-Amz-Date=20200415T154606Z&X-Amz-Expires=604800&X-Amz-SignedHeaders=host&X-Amz-Signature=58e250620305348db209ef2c306240fcb8971117f785dc28a077e884bca10016,0.75,"",1.0,"",1.0,"",4.0,"",4.0,,,,,,,Thank you @MarmaladeCafe for your generous donation to ASF !,,,
2684649325,false,finalized,3,3/13/2020 17:10:39,https://f8-text-annotation-live.s3.amazonaws.com/agg_report/2684649325/e349ac7826076b6fd983c146dcae012f41e933e0?X-Amz-Algorithm=AWS4-HMAC-SHA256&X-Amz-Credential=AKIAIK6U7WPQWDCESAOQ%2F20200415%2Fus-east-1%2Fs3%2Faws4_request&X-Amz-Date=20200415T154606Z&X-Amz-Expires=604800&X-Amz-SignedHeaders=host&X-Amz-Signature=b0785e2e0101c2f13920d7525a5d0131d8e0f77da73acaf0642b69bbdd8a7545,0.8333,"",1.0,"",1.0,https://f8-text-annotation-live.s3.amazonaws.com/agg_report/2684649325/e349ac7826076b6fd983c146dcae012f41e933e0?X-Amz-Algorithm=AWS4-HMAC-SHA256&X-Amz-Credential=AKIAIK6U7WPQWDCESAOQ%2F20200415%2Fus-east-1%2Fs3%2Faws4_request&X-Amz-Date=20200415T154607Z&X-Amz-Expires=604800&X-Amz-SignedHeaders=host&X-Amz-Signature=7d7838d967034be8bf56129d8443e7a37fc955d7ea49f2d985cc1fcacbecdebc,0.5,"",1.0,"",1.0,"",0.8333,"",2.8333,,,,,,,"Hi all ive been reading a lot of your stories and posts and thought i would share . Im a 39 year old male , living in Ireland . I have been attending a neuro for 4 years under query of ms . I've had an mri done every year , spinal tap , bloods , nerve conduction study and all negative appart from a lesion at c3 that was present on an mri in 2015 but has subsequently shrunk and disappeared . Brain scans showed moderate brain atrophy in 2015 but that has also improved to be no notable atrophy this year . I have symptoms of numbness and tingling in legs and arms , bowel ( constipation and diarrhoea in one day ) and bladder problems , balance problems , my left foot feels like its in a boot all the time and my toes , hands and calf muscles spasm most days . Ive also lost feeling on my left leg around the ankle area . Im quite fit and run and exercise a good bit but theres days when i cant manage a flight of stairs . Recently after doing some gardening work , I lost power in my arms for about two weeks , unable to squeeze toothpaste or open a jar and after two weeks the power and feeling returned . If its cold out my hands and feet go numb almost immediately and I lose dexterity in them and the toes on my left foot go numb almost as soon as i start to walk or run . If its hot out , im sweating buckets and buzzing all over . Quite a lot going on but most of it is more of an annoyance and for the most part it doesnt stop me doing what I want to do but the sypmtoms im having keep seeing to increase and I'm picking up new ones as time goes on . The neurologist has diagnosed me with transverse myelitis and prescribed gabapentin and amyltripoline for the symptoms . Neither medication worked that well and when I bring this up with gp or Neuro they just increase the dosage which worked for a couple of weeks and then symptoms return . There seems to be a pattern to the symptoms in that they start to increase in severity over a period of a few weeks to the point where my whole body is buzzing and tingling , ill be unable to sleep for a couple of days and then it will slow down a bit but never really go away . Does anyone else on here have a similar diagnosis and do you have any idea of prognosis for the long or short term ? I have a hard time understanding how or why symptoms would appear new or get worse if the lesion has actually shrunk .",,,
2684649326,false,finalized,3,3/13/2020 16:06:35,"",1.0,"",1.0,"",1.0,https://f8-text-annotation-live.s3.amazonaws.com/agg_report/2684649326/1159b8ad7064f6d46d3321f005526e478c0c3c72?X-Amz-Algorithm=AWS4-HMAC-SHA256&X-Amz-Credential=AKIAIK6U7WPQWDCESAOQ%2F20200415%2Fus-east-1%2Fs3%2Faws4_request&X-Amz-Date=20200415T154607Z&X-Amz-Expires=604800&X-Amz-SignedHeaders=host&X-Amz-Signature=06d7e95db5e35cf24f8ad173044acbc7d43d1019b228c17bff8a44b2132507d4,0.6667,"",1.0,"",1.0,does_not_contain_an_age_mention,2.0,"",3.0,,,,,,,RT @proloquo2go : Today is International Angelman syndrome day ! Have you heard about the Angelman revolution ? #Angelman #AAC https://t.co/hz… .,,,
2684649327,false,finalized,3,3/13/2020 16:06:35,"",1.0,"",1.0,"",1.0,https://f8-text-annotation-live.s3.amazonaws.com/agg_report/2684649327/d2ca927bdc65e0ac32b9f200fdd23e2f7aec407b?X-Amz-Algorithm=AWS4-HMAC-SHA256&X-Amz-Credential=AKIAIK6U7WPQWDCESAOQ%2F20200415%2Fus-east-1%2Fs3%2Faws4_request&X-Amz-Date=20200415T154608Z&X-Amz-Expires=604800&X-Amz-SignedHeaders=host&X-Amz-Signature=458cbf90c94d54d01040495a24ff00db550e46fe5f279b48bc6cf1f368beef9f,0.6667,"",1.0,"",1.0,does_not_contain_an_age_mention,2.0,"",3.0,,,,,,,"Look who ’ s raising awareness for Angelman Syndrome and the ASF Walk this morning at her Jr High school ! Madonna just loves wearing her walk shirt and clapped when we got ready this morning ! We say , “ Come to the walk everyone ! ” It just makes her beam ! ! Register by April 3rd in a city near you and get your t-shirt at www.angelman.org/Walk Thank you for your support each year !",,,
2684649328,false,finalized,3,3/13/2020 17:11:10,"",1.0,"",1.0,"",1.0,https://f8-text-annotation-live.s3.amazonaws.com/agg_report/2684649328/2f151be4abe860bd2e7f01cbacd829a8cabb3129?X-Amz-Algorithm=AWS4-HMAC-SHA256&X-Amz-Credential=AKIAIK6U7WPQWDCESAOQ%2F20200415%2Fus-east-1%2Fs3%2Faws4_request&X-Amz-Date=20200415T154608Z&X-Amz-Expires=604800&X-Amz-SignedHeaders=host&X-Amz-Signature=bf69265c8172b9e691d711156ef4668925186873d1f6c7c2c9a0bd17be5061d1,0.5,"",1.0,"",0.6667,"",3.0,"",3.0,,,,,,,RT @cureangelman : Working hard to bring treatments forward for Angelman syndrome . Thank you Disruptive Nutrition ! ! https://t.co/TxGwP5hXBI .,,,
