_unit_id,_golden,_unit_state,_trusted_judgments,_last_judgment_at,annotation,annotation:confidence,annotation_1,annotation_1:confidence,annotation_2,annotation_2:confidence,annotations,annotations:confidence,contains_age_mention,contains_age_mention:confidence,does_not_contain_age_mention,does_not_contain_age_mention:confidence,does_not_contain_an_age_mention,does_not_contain_an_age_mention:confidence,doesnt_contain_age_mention,doesnt_contain_age_mention:confidence,about_patient,annotation_gold,contains_age_mention_gold,does_not_contain_age_mention_gold,mentions_disease,portal_url,text_raw,text_toks,title_raw,title_toks
2684649329,false,finalized,3,3/13/2020 17:28:32,"",1.0,"",1.0,"",1.0,https://f8-text-annotation-live.s3.amazonaws.com/agg_report/2684649329/8ccfbb4e110efc3e5c437ee54b5083bab24f1bc8?X-Amz-Algorithm=AWS4-HMAC-SHA256&X-Amz-Credential=AKIAIK6U7WPQWDCESAOQ%2F20200415%2Fus-east-1%2Fs3%2Faws4_request&X-Amz-Date=20200415T154556Z&X-Amz-Expires=604800&X-Amz-SignedHeaders=host&X-Amz-Signature=68d6222837e50090a4d83c0168b71ba7d24a523591944b1df75eb9a44296c5d4,0.5,"",1.0,"",0.6667,"",3.0,"",3.0,,,,,,,"Our individuals with Angelman Syndrome are largely non verbal . Some have a few words . Makaton / BSL etc can be challenging for them due to ataxia ( shaking ) , dyskinesia ( involuntary movements ) and ... https://t.co/KQHvax8774 .",,,
2684649330,false,finalized,3,3/13/2020 15:49:56,"",1.0,"",1.0,"",1.0,https://f8-text-annotation-live.s3.amazonaws.com/agg_report/2684649330/b6f968c1f4eee4a65302d5b1be3469dc2b000cb8?X-Amz-Algorithm=AWS4-HMAC-SHA256&X-Amz-Credential=AKIAIK6U7WPQWDCESAOQ%2F20200415%2Fus-east-1%2Fs3%2Faws4_request&X-Amz-Date=20200415T154556Z&X-Amz-Expires=604800&X-Amz-SignedHeaders=host&X-Amz-Signature=f6d49097ecb44d75cbb9bbf9fdefc44a7d274d24c42ea34d8e0aaad791ab59f7,0.6667,"",1.0,"",1.0,"",1.0,"",3.0,,,,,,,"This is from April 2017 , and seems quite promising - even though in Phase 1 . Any further news on gene therapy for people with Parkinsons - early or later stages ? : https://parkinsonsnewstoday.com/2017/04/26/phase-1-study-of-voyager-therapeutics-gene-therapy-shows-potential-for-parkinsons-disease/ .",,,
2684649331,false,finalized,3,3/13/2020 15:54:29,"",1.0,"",1.0,"",1.0,https://f8-text-annotation-live.s3.amazonaws.com/agg_report/2684649331/22e10991abfea0962fd544ed2dc40a6c3807efd8?X-Amz-Algorithm=AWS4-HMAC-SHA256&X-Amz-Credential=AKIAIK6U7WPQWDCESAOQ%2F20200415%2Fus-east-1%2Fs3%2Faws4_request&X-Amz-Date=20200415T154557Z&X-Amz-Expires=604800&X-Amz-SignedHeaders=host&X-Amz-Signature=658e61302ab69420314c6f465b0c8330e6cbde4a4900f86850f0d740a5bd0821,0.6667,"",1.0,"",1.0,does_not_contain_an_age_mention,3.0,"",3.0,,,,,,,"Also have the ER Room Card printed and ready . [ https://www.lbda.org/content/lbd-medical-alert-wallet-card ] ( https://www.lbda.org/content/lbd-medical-alert-wallet-card ) ​ Critical is : > 4 . Antipsychotic agents may be indicated if psychotic symptoms are severe and pose a significant safety risk . AVOIDtraditional antipsychotic agents ( e . g . , haloperidol ) . Newer atypical antipsychotic agents ( e . g . , quetiapine , clozapine ) should only be used with caution at the lowest dose possible , under close supervision of a physician and an RN , and should be switched to a safer medication as soon as possible ​ Haldol ( haloperidol ) should never be administered to anyone with Parkinson's nor Lewy Body . It has a an adverse effect on our cognitive functioning , yet is the first thing ER Physicians grab when they have a combative patient . Highly effective for Alzheimer , but horrible for Parkinson's / Lewy Body . Parkinson's Disease is when we have a bush on fire , Lewy Body Dementia is like the whole forest is on fire . We can control it for so long , but sadly long term care facilities are needed towards the end . Not something we wish on anyone , it just damn hard . PDD ( Parkinson's Disease with Dementia ) means Parkinson's symptoms started first . Not everyone with PD develops into PDD ; Lewy Body Dementia ( LDB ) is when cognitive and Parkinson's Symptoms develop at the same time . Both are based on a misfolded protein known as alpha-synuclein .",,,
2684649332,false,finalized,3,3/13/2020 17:45:31,"",1.0,"",1.0,"",1.0,https://f8-text-annotation-live.s3.amazonaws.com/agg_report/2684649332/e8910d6f940ba66281fd77aed8d7db4025e76f10?X-Amz-Algorithm=AWS4-HMAC-SHA256&X-Amz-Credential=AKIAIK6U7WPQWDCESAOQ%2F20200415%2Fus-east-1%2Fs3%2Faws4_request&X-Amz-Date=20200415T154558Z&X-Amz-Expires=604800&X-Amz-SignedHeaders=host&X-Amz-Signature=a81ae3b068548cf1749e047493d81d3dcf49894d9ce0cad64171dc19d6bb5cc4,0.5,"",1.0,"",0.7059,"",1.8333,"",2.8333,,,,,,,"A book I recommend everyone ( Person & caregiver ) get : [ https://www.amazon.com/New-Parkinsons-Disease-Treatment-Book/dp/0190231866 ] ( https://www.amazon.com/New-Parkinsons-Disease-Treatment-Book/dp/0190231866 ) Every appointment I take in a two page summary . 1 . Why I am here 2 . What I hope to resolve ( i . e . what do I need to go , follow up , etc ) 3 . Medications I am on ( medicine , dose , how often , who prescribed , why I take it ) 4 . Summary of other doctors visit , doc , speciality - one line summary . ​ I find some doc's ( often fresh out of school ) have too many patients . They are rushed , they have $ 500,000 in medical debt , and need to see patients as fast as possible ( higher turn over , the more than can bill ) . They can be great docs , but this is part of our medical system . So I try to make their job as easy as possible ( hence my summary page ) . It is up to us to be our own best advocate . Ideally have someone with you at all appointments to take notes . Requip can be used as an adjunct therapy ( in addition to ) a lower does of Sinemet , but telling a patient to swap on for the other could be a disaster . I'm not a doc , nor to I play on TV , but educate yourself about Requip and Dopamine Agonist ( I had issues with compulsive shopping ) . [ https://parkinson.org/Understanding-Parkinsons/Treatment/Prescription-Medications/Dopamine-Agonists ] ( https://parkinson.org/Understanding-Parkinsons/Treatment/Prescription-Medications/Dopamine-Agonists ) ​ [ https://parkinson.org/Understanding-Parkinsons/Symptoms/Non-Movement-Symptoms/Sleep-Disorders ] ( https://parkinson.org/Understanding-Parkinsons/Symptoms/Non-Movement-Symptoms/Sleep-Disorders ) ​ There is a 1-800 number listed . Yes , their hot line is staffed by RN's who can assist . Does he have the Patient Safety Kit ? ( USA only as medications listed . Still recommended everyone download PDF's and annotate with your regions medications ) [ https://parkinson.org/Living-with-Parkinsons/Resources-and-Support/Patient-Safety-Kit ] ( https://parkinson.org/Living-with-Parkinsons/Resources-and-Support/Patient-Safety-Kit ) # ​ .",,,
2684649333,false,finalized,3,3/13/2020 15:41:27,"",1.0,"",1.0,"",1.0,https://f8-text-annotation-live.s3.amazonaws.com/agg_report/2684649333/44b9dd207948bd9f76daf22bd149c68f707d3541?X-Amz-Algorithm=AWS4-HMAC-SHA256&X-Amz-Credential=AKIAIK6U7WPQWDCESAOQ%2F20200415%2Fus-east-1%2Fs3%2Faws4_request&X-Amz-Date=20200415T154558Z&X-Amz-Expires=604800&X-Amz-SignedHeaders=host&X-Amz-Signature=eabc36f5ae449822b3e71158eded2ee25259f4634b0554da9cda6cdd326d3f19,0.6667,"",1.0,"",1.0,"",3.0,"",3.0,,,,,,,"Not sure if bronchitis can be traced back at all to MS ... maybe the lower immune system . But I have acute bronchitis apparently . It's bad at night leading me to hacking up a lung and sometimes causing me to start gagging , plus a headache from coughing too .. Anyway I was prescribed a rescue inhaler , and I attempted to use it earlier but I chickened out and only did a little .. then the taste made me immediately run to the bathroom to * ahem * remove my lunch . Any tips on doing inhalers ? Idk why it freaks me out but it does . And I really don't want to get so nauseous again .",,,
2684649334,false,finalized,3,3/13/2020 17:14:04,"",1.0,"",1.0,"",1.0,https://f8-text-annotation-live.s3.amazonaws.com/agg_report/2684649334/5f09edbb55ac40d17934740315b97f124268298f?X-Amz-Algorithm=AWS4-HMAC-SHA256&X-Amz-Credential=AKIAIK6U7WPQWDCESAOQ%2F20200415%2Fus-east-1%2Fs3%2Faws4_request&X-Amz-Date=20200415T154558Z&X-Amz-Expires=604800&X-Amz-SignedHeaders=host&X-Amz-Signature=d7f3b793a2336d82c14e3138de6a5ff69a20ca805604b9dc6b948e764031f800,1.0,"",1.0,does_not_contain_age_mention,0.6667,"",2.0,"",3.0,,,,,,,"Not at all likely to be Parkinsons disease ... really OP you really don't sound like the symptoms you are experiencing are as a result of PD . I can recommend to you that seeing an experienced neurologist is a very good idea . The next best good idea is to insist on being given a referal to a neurologist who is a "" clinical movement specialist . "" Yes this exact doctor does exist somewhere near you . But good to see neurologist and then maybe get this second opinion . No one on reddit should attempt to guess what is going to ultimately be determined to be the correct Dx of your tremors etc . It is certainly possible that some rather easily treatable cause might be causing most of your distress so honestly there is great hope in your particular case . Please post if you learn more and feel like sharing ! Very good luck ! K . < ^ .",,,
2684649335,false,finalized,4,3/13/2020 15:52:45,"",1.0,"",1.0,"",1.0,https://f8-text-annotation-live.s3.amazonaws.com/agg_report/2684649335/59f61c6a61c38c06e28a2c61a91e44507edc1d63?X-Amz-Algorithm=AWS4-HMAC-SHA256&X-Amz-Credential=AKIAIK6U7WPQWDCESAOQ%2F20200415%2Fus-east-1%2Fs3%2Faws4_request&X-Amz-Date=20200415T154559Z&X-Amz-Expires=604800&X-Amz-SignedHeaders=host&X-Amz-Signature=d9f73cf79ac81c5c5c693f566cb4fa1e8d815b0a8beb5abc51023480c3043077,0,"",1.0,"",1.0,does_not_contain_an_age_mention,2.0,"",4.0,,,,,,,#NewVideo #Premiere . Taking full advantage of a new feature . Come watch over on YT . Multiple Sclerosis affects emotions due to lesions on the brain . It's a challenge every day . 💜 . multiplesclerosis #ms #PositiveLivingWithMS @mssocietyuk @mssociety .,,,
2684649336,false,finalized,3,3/13/2020 17:17:15,https://f8-text-annotation-live.s3.amazonaws.com/agg_report/2684649336/463e4f491d32b42336d3e05b2ad7c04bf5c104f6?X-Amz-Algorithm=AWS4-HMAC-SHA256&X-Amz-Credential=AKIAIK6U7WPQWDCESAOQ%2F20200415%2Fus-east-1%2Fs3%2Faws4_request&X-Amz-Date=20200415T154559Z&X-Amz-Expires=604800&X-Amz-SignedHeaders=host&X-Amz-Signature=d7ecd2a12735b1660e02fdb4ce17414caf35922dd45923eac5afeca7773854bc,1.0,"",1.0,"",1.0,https://f8-text-annotation-live.s3.amazonaws.com/agg_report/2684649336/463e4f491d32b42336d3e05b2ad7c04bf5c104f6?X-Amz-Algorithm=AWS4-HMAC-SHA256&X-Amz-Credential=AKIAIK6U7WPQWDCESAOQ%2F20200415%2Fus-east-1%2Fs3%2Faws4_request&X-Amz-Date=20200415T154600Z&X-Amz-Expires=604800&X-Amz-SignedHeaders=host&X-Amz-Signature=6315cf7fd1774ebe5ef7fa072b6a7b8bafaa98e6ddd988e45e08226924b1fbf3,1.0,"",1.0,"",1.0,"",3.0,"",3.0,,,,,,,"1 . What do you use for focus / fatigue ? I'm back on Adderall ( which is awesome as I am also back on weight watchers so ... ) I was on Mofandil for a bit but health insurance approval was a bitch plus I didn't think was as good as Adderall 2 . Anyone else find essential oils with a diffuser helps with fatigue , negativity , and depression ? I do and I wanted to share and see if anyone has similar experiences or something they like better or is it psychosomatic ? If so , what scents do you find helpful ? 3 . Does anyone take nootropics ? I take [ these ] ( https://hvmn.com/nootrobox ) . I think they help , but again , psychosomatic ? Beats me 4 . I am an atheist but I am real into [ Discordianism ] ( http://discordia.wikia.com/wiki/Discordianism ) . As a 9/11 survivor who was DXed almost 3 months to the day after , well ... If I'm wrong and there is a God , when I get there she better get down on her knees and beg MY forgiveness . Do you find spirituality helps you ? What kind of things do you do for that sense of inner peace or at least feeling like the cross you bear isn't too heavy ? 5 . How do you deal with sexual issues ? I don't know if this is a Man thing or an Apikoros 18 thing but ... As mentioned by me in other posts , I need an injection ( trimix ) to achieve an erection . I cannot masturbate anymore but I still look at adult material . I still look at women , and even more want to have PIV intimacy with my wife . BUT , it can never be spontaneous anymore and with a 9 year old with special needs , even finding the time is difficult , let alone all the prep work . ( 15 mins for the meds after you take them from the freezer , than the injection , than 15 mins to get an erection ) Even then sometimes the meds don't work . They degrade over time and at 175 / $ a vial , you want to make it last as long as possible ( No pun intended . OK , maybe a little ) The bottom line is I still feel horny , I still get arouse ( in my head ) but the frustration of not being able to act on it ... It hurts me as a man . Yes , I'm in therapy about it but it doesn't stop the thoughts and feelings , the self esteem issues etc . 6 . Related to # 5 , would it be weird to inject myself to jerk off ? I feel its weird but I work from home so I could without anyone being the wiser but it feels selfish and weird . Anyway , that's just some stuff going on in my head as I approach year 16 of being diagnosed ( and year 2 , maybe 3 ) of being secondary progressive instead of RRMS .",,,
2684649337,false,finalized,3,3/13/2020 17:13:01,"",1.0,"",1.0,"",1.0,https://f8-text-annotation-live.s3.amazonaws.com/agg_report/2684649337/0ff80658dd1a0ca7aa8c91d4254b384a363f42c0?X-Amz-Algorithm=AWS4-HMAC-SHA256&X-Amz-Credential=AKIAIK6U7WPQWDCESAOQ%2F20200415%2Fus-east-1%2Fs3%2Faws4_request&X-Amz-Date=20200415T154600Z&X-Amz-Expires=604800&X-Amz-SignedHeaders=host&X-Amz-Signature=e3fd6ad4110d5f028147507e5bade7823c1c88bdf63b117fc91fe482e5108d69,0.5,"",1.0,"",0.65,"",2.8571,"",2.8571,,,,,,,Assessing the effects of post-acute rehabilitation services on health care outcomes for people with #multiplesclerosis . https://t.co/aqe6pHqCht https://t.co/n4fMwEU057 .,,,
2684649338,false,finalized,3,3/13/2020 17:10:32,"",1.0,"",1.0,"",1.0,https://f8-text-annotation-live.s3.amazonaws.com/agg_report/2684649338/69b91ed07fc8411b88baef031871ce9536fd1909?X-Amz-Algorithm=AWS4-HMAC-SHA256&X-Amz-Credential=AKIAIK6U7WPQWDCESAOQ%2F20200415%2Fus-east-1%2Fs3%2Faws4_request&X-Amz-Date=20200415T154601Z&X-Amz-Expires=604800&X-Amz-SignedHeaders=host&X-Amz-Signature=3fa81695392f80309f541ea9a42465e4f310b79cfe27fb2653980c0bf3138dcb,0.5,"",1.0,"",0.6667,"",3.0,"",3.0,,,,,,,"finally , cholesterol might play a pivotal role , since higher levels protect against PD , yes that's right , they protect . Neurologist Dr . Perlmutter also has a nice list at the end of this article related to nutrition that can help keep PD away here : https://www.mindbodygreen.com/0-10979/what-i-wish-everyone-knew-about-parkinsons-disease.html The most painful thing to learn about all this is that the types of nutrition that seems to protect from PD is exactly what is recommend to be cut out of the diet when medicating with levodopa , since levodopa competes with amino acids in the ingestion .",,,
2684649339,false,finalized,4,3/13/2020 15:52:45,"",1.0,"",1.0,"",1.0,https://f8-text-annotation-live.s3.amazonaws.com/agg_report/2684649339/69343e9b088442938fecdf789a421024bc73d940?X-Amz-Algorithm=AWS4-HMAC-SHA256&X-Amz-Credential=AKIAIK6U7WPQWDCESAOQ%2F20200415%2Fus-east-1%2Fs3%2Faws4_request&X-Amz-Date=20200415T154601Z&X-Amz-Expires=604800&X-Amz-SignedHeaders=host&X-Amz-Signature=83979d882d4afbef5ea356d26b3f852d17718c0e50183ac9a69e26f5aa972e8b,0.5,"",1.0,"",1.0,does_not_contain_an_age_mention,2.0,"",4.0,,,,,,,Got a bunch of followers . Any MSers want a label read ? Anyone have a hunch what caused their MS ? Anyone want to discuss the foods with increased lysolecithin ? Let's talk .,,,
2684649340,false,finalized,3,3/13/2020 17:14:04,https://f8-text-annotation-live.s3.amazonaws.com/agg_report/2684649340/4a23017da0e466ba712e52278d80bf025b22fcfc?X-Amz-Algorithm=AWS4-HMAC-SHA256&X-Amz-Credential=AKIAIK6U7WPQWDCESAOQ%2F20200415%2Fus-east-1%2Fs3%2Faws4_request&X-Amz-Date=20200415T154602Z&X-Amz-Expires=604800&X-Amz-SignedHeaders=host&X-Amz-Signature=de995db5d0e84594983fae23622e3dc922a776c5f8e7e701b1f7d43cb87edb75,1.0,"",1.0,"",1.0,https://f8-text-annotation-live.s3.amazonaws.com/agg_report/2684649340/4a23017da0e466ba712e52278d80bf025b22fcfc?X-Amz-Algorithm=AWS4-HMAC-SHA256&X-Amz-Credential=AKIAIK6U7WPQWDCESAOQ%2F20200415%2Fus-east-1%2Fs3%2Faws4_request&X-Amz-Date=20200415T154602Z&X-Amz-Expires=604800&X-Amz-SignedHeaders=host&X-Amz-Signature=de995db5d0e84594983fae23622e3dc922a776c5f8e7e701b1f7d43cb87edb75,1.0,"",1.0,"",0.6667,"",2.0,"",3.0,,,,,,,"This will be my 7th season with the Bike MS . Together , we raise funds to change the world for people with MS . If you can , please use this link to donate any amount - . #bike #BikeMS #BikeMS2019 #mssociety #bikeride #curems #fundraising https://t.co/1fHbHRTWoG .",,,
2684649341,false,finalized,3,3/13/2020 17:45:31,"",1.0,"",1.0,"",1.0,https://f8-text-annotation-live.s3.amazonaws.com/agg_report/2684649341/ab67ee21c89413b72a119d8847eae81f7a3bdac1?X-Amz-Algorithm=AWS4-HMAC-SHA256&X-Amz-Credential=AKIAIK6U7WPQWDCESAOQ%2F20200415%2Fus-east-1%2Fs3%2Faws4_request&X-Amz-Date=20200415T154602Z&X-Amz-Expires=604800&X-Amz-SignedHeaders=host&X-Amz-Signature=6f447d7d360a177730b4e327e8866510d2e3c6eb0c19c32c900ad914f11aa856,1.0,"",1.0,"",0.7059,"",1.8333,"",2.8333,,,,,,,Nulante South Africa It draws in to diminish and dispose of the distinguishable nature of wrinkles and settled barely recognizable complexities and is especially a source to keep up the brilliance of skin surface . You have to engage yourself to apply the cream for something near three to four months . It is a to an incredible degree lightweight source that gets acclimatized to epidermis effectively without making blockage outside skin tissues . One may clarification lessen the closeness of dark circles and verbalization lines .,,,
2684649342,false,finalized,4,3/13/2020 15:49:58,"",1.0,"",1.0,"",1.0,https://f8-text-annotation-live.s3.amazonaws.com/agg_report/2684649342/e763a888cf43158ecef3760f82dfe12a0a3e728d?X-Amz-Algorithm=AWS4-HMAC-SHA256&X-Amz-Credential=AKIAIK6U7WPQWDCESAOQ%2F20200415%2Fus-east-1%2Fs3%2Faws4_request&X-Amz-Date=20200415T154603Z&X-Amz-Expires=604800&X-Amz-SignedHeaders=host&X-Amz-Signature=41017c98f791a1766059f1dabbd5f78f78d71686206ae91a090d2036fc2862cc,0.5,"",1.0,"",1.0,"",3.0,"",4.0,,,,,,,"I always thought I'd be the work-til-I-die type like my parents and grandfather ( my grandpa died at work ) , but the fatigue , numbness , pain , and all around HEAVINESS that comes with MS has left me almost bed-ridden . I can't make it out of my apartment anymore without assistance , I feel half-asleep 24/7 even with the Modafinil . can't feel the left side of my body at all and have a giant burn on my forearm to prove it that I gave myself a couple days ago while cooking . Scariest part is I didn't even FEEL it when it happened , I only found out waking up the next morning with a giant , ugly blister and no recollection of how it could've gotten there . I feel like my body is slowly breaking down and I'm only 25 years old . I'm happy and relieved I can stop thinking about money but I miss feeling useful . I want to eventually go back to my 40 + hour-a-week rat race job , but a tiny voice in the back of my head is telling me I can't . I don't know if there's a hell , but this certainly feels close .",,,
2684649343,false,finalized,3,3/13/2020 17:10:39,"",1.0,"",1.0,"",1.0,https://f8-text-annotation-live.s3.amazonaws.com/agg_report/2684649343/0d1e5a64bec53328891ee3df637a9067f5d64c10?X-Amz-Algorithm=AWS4-HMAC-SHA256&X-Amz-Credential=AKIAIK6U7WPQWDCESAOQ%2F20200415%2Fus-east-1%2Fs3%2Faws4_request&X-Amz-Date=20200415T154604Z&X-Amz-Expires=604800&X-Amz-SignedHeaders=host&X-Amz-Signature=14b1fd6254947c04bf14d32a35d8247c793b03188dfbef55132207480a06f9ad,0.5,"",1.0,"",0.7059,"",0.8333,"",2.8333,,,,,,,I've only done 6 shots of the Glatiramer . Is that even giving it a chance ? What can I expect with Ocrevus ?,,,
2684649344,false,finalized,3,3/13/2020 17:10:32,"",1.0,"",1.0,"",1.0,https://f8-text-annotation-live.s3.amazonaws.com/agg_report/2684649344/479fddc8fdcff5c1ef52c67212cdfe6c34763bef?X-Amz-Algorithm=AWS4-HMAC-SHA256&X-Amz-Credential=AKIAIK6U7WPQWDCESAOQ%2F20200415%2Fus-east-1%2Fs3%2Faws4_request&X-Amz-Date=20200415T154604Z&X-Amz-Expires=604800&X-Amz-SignedHeaders=host&X-Amz-Signature=15d671025128b750b050890891bc0f003b9058399d1e5ce0f400821b4beafed7,0.5,"",1.0,"",0.6667,"",3.0,"",3.0,,,,,,,"Since I got my diagnosis I've been trying like crazy to live the healthiest life I can . Exercise , stress management , med compliance , etc . And I've actually been doing pretty well with that . Except when it comes to sugar . I want very much to improve my diet and lose weight , not for vanity's sake , but in case I end up losing motor function and need to be cared for . And because I really don't want to end up with both MS and diabetes . But out of control sugar binges are killing me . Diets , therapy , meditation , 12 step groups , nothing has helped . And I realized this week it's because sugar is the only medicine that I can feel working , but it only works while I'm actually eating it . When my mouth is full of sugar is the one time when I really feel distracted from how much pain I'm in . My ability to resist sugar rests with how much physical and emotional pain I'm in . I'm trying to figure out what to do with this information . On the one hand I understand what's standing in my way . On the other , I don't know how to deny myself the one thing that makes me feel better .",,,
2684649345,false,finalized,3,3/13/2020 15:54:29,"",1.0,"",1.0,"",1.0,https://f8-text-annotation-live.s3.amazonaws.com/agg_report/2684649345/dad8647f23a5eb8bbeabc31fbfb03294101b3ec1?X-Amz-Algorithm=AWS4-HMAC-SHA256&X-Amz-Credential=AKIAIK6U7WPQWDCESAOQ%2F20200415%2Fus-east-1%2Fs3%2Faws4_request&X-Amz-Date=20200415T154604Z&X-Amz-Expires=604800&X-Amz-SignedHeaders=host&X-Amz-Signature=cd534b9903c2421cdb37721642d0a46675283c49cf5c0a57e20e8e28b408e7b5,0,"",1.0,"",1.0,does_not_contain_an_age_mention,3.0,"",3.0,,,,,,,Multiple Sclerosis Symptoms : How Selma Blair's Story Sheds Light On Condition - https://t.co/EmIqlx21Rb https://t.co/xhSqCKanEl .,,,
2684649346,false,finalized,4,3/13/2020 15:40:24,"",1.0,"",1.0,"",1.0,https://f8-text-annotation-live.s3.amazonaws.com/agg_report/2684649346/ba823467d4648eb67f07b51672d103e91182fe35?X-Amz-Algorithm=AWS4-HMAC-SHA256&X-Amz-Credential=AKIAIK6U7WPQWDCESAOQ%2F20200415%2Fus-east-1%2Fs3%2Faws4_request&X-Amz-Date=20200415T154605Z&X-Amz-Expires=604800&X-Amz-SignedHeaders=host&X-Amz-Signature=676ba1e454c285f9cd33d845cc7edd774f6789024b348f653f78b2f254e2cefa,0.75,"",1.0,"",1.0,"",4.0,"",4.0,,,,,,,It will be very soon ! Just working to finalize a few more details !,,,
